"","sent_raw","jockers_rinker","jockers","huliu","lmcd","nrc","senticnet","sentiword"
"901","900,""The Ghost was greatly pleased to find him in this mood, and looked upon him with such favour, that he begged like a boy to be allowed to stay until the guests departed.""",0.308117451041585,0.134039795085887,0.661495092631652,0.313339780720256,-0.0348155311911396,0.00664976645750764,-0.029012942659283
"902","901,But this the Spirit said could not be done.",0.166666666666667,0.166666666666667,0,0,0.333333333333333,-0.071,0.125
"903","902,""""""Here is a new game,"""" said Scrooge.""",0.302371578407382,0.302371578407382,0,0,0,-0.07823864591291,-0.157485197087178
"904","903,""""""One half hour, Spirit, only one!""""""",0.204124145231932,0.204124145231932,0,0,0.408248290463863,-0.119208500815448,0.153093108923949
"905","904,""It was a Game called Yes and No, where Scrooge's nephew had to think of something, and the rest must find out what; he only answering to their questions yes or no, as the case was.""",-0.16,-0.16,0,0.0333333333333333,0,0.148,0.00208333333333334
"906","905,""The brisk fire of questioning to which he was exposed, elicited from him that he was thinking of an animal, a live animal, rather a disagreeable animal, a savage animal, an animal that growled and grunted sometimes, and talked sometimes, and lived in London, and walked about the streets, and wasn't made a show of, and wasn't led by anybody, and didn't live in a menagerie, and was never killed in a market, and was not a horse, or an ass, or a cow, or a bull, or a tiger, or a dog, or a pig, or a cat, or a bear.""",-0.420812705765087,-0.321797951467419,-0.297044262893002,-0.297044262893002,-0.39605901719067,0.0623792952075305,-0.32282935515802
"907","906,""At every fresh question that was put to him, this nephew burst into a fresh roar of laughter; and was so inexpressibly tickled, that he was obliged to get up off the sofa and stamp.""",0.405674042269688,0.405674042269688,0.338061701891407,-0.169030850945703,0.338061701891407,0.263350065773406,-0.247559767114228
"908","907,""At last the plump sister, falling into a similar state, cried out:""",-0.505181485540923,-0.505181485540923,-0.288675134594813,0,-0.288675134594813,-0.163967476449854,0.0360843918243516
"909","908,""""""I have found it out! I know what it is, Fred! I know what it is!""""""",0.15,0.15,0,0,0.25,0.07225,-0.0625
"910","909,""""""What is it?"""" cried Fred.""",-0.447213595499958,-0.447213595499958,0,0,0,0,0
"911","910,""""""It's your Uncle Scro-o-o-o-oge!""""""",0,0,0,0,0,0.19763634534164,0
"912","911,Which it certainly was.",0,0,0,0,0,0,0
"913","912,""Admiration was the universal sentiment, though some objected that the reply to """"Is it a bear?"""" ought to have been """"Yes;"""" inasmuch as an answer in the negative was sufficient to have diverted their thoughts from Mr. Scrooge, supposing they had ever had any tendency that way.""",0.320902981295368,0.320902981295368,0.145864991497895,-0.437594974493684,0,0.421987420403409,-0.194486655330526
"914","913,""""""He has given us plenty of merriment, I am sure,"""" said Fred, """"and it would be ungrateful not to drink his health. Here is a glass of mulled wine ready to our hand at the moment; and I say, 'Uncle Scrooge!'""""""",0.195217202360758,0.0312347523777212,0.320156211871642,0,0.312347523777212,0.0766813170873056,0.0195217202360758
"915","914,""""""Well! Uncle Scrooge!"""" they cried.""",-0.0894427190999916,-0.0894427190999916,0.447213595499958,0,0,0.571538975048946,0.21493085399728
"916","915,""""""A Merry Christmas and a Happy New Year to the old man, whatever he is!"""" said Scrooge's nephew.""",0.601040764008565,0.601040764008565,0.471404520791032,0.235702260395516,0.471404520791032,0.503224325944426,0.108030202681278
"917","916,""""""He wouldn't take it from me, but may he have it, nevertheless. Uncle Scrooge!""""""",0,0,0,0,0,0.0249221108083336,-0.375836121439347
"918","917,""Uncle Scrooge had imperceptibly become so gay and light of heart, that he would have pledged the unconscious company in return, and thanked them in an inaudible speech, if the Ghost had given him time.""",-0.405674042269688,-0.228191648776699,-0.346513244438692,0,-0.169030850945703,0.124237675445092,0.0316932845523194
"919","918,But the whole scene passed off in the breath of the last word spoken by his nephew; and he and the Spirit were again upon their travels.",0.0962250448649376,0.0962250448649376,0,0,0.384900179459751,0.242487113059643,-0.1162719292118
"920","919,""Much they saw, and far they went, and many homes they visited, but always with a happy end.""",0.397747564417433,0.397747564417433,0.530330085889911,0.530330085889911,0.530330085889911,0.485959135370455,0.294627825494395
"921","920,""The Spirit stood beside sick beds, and they were cheerful; on foreign lands, and they were close at home; by struggling men, and they were patient in their greater hope; by poverty, and it was rich.""",0.166666666666667,0.166666666666667,0,0.166666666666667,0.333333333333333,0.148333333333333,-0.0194444444444444
"922","921,""In almshouse, hospital, and jail, in misery's every refuge, where vain man in his little brief authority had not made fast the door, and barred the Spirit out, he left his blessing, and taught Scrooge his precepts.""",0.139739139209554,0.172618936670625,0.164398987305357,-0.164398987305357,-0.0328797974610715,0.02393649255166,0.0143849113892188
"923","922,""It was a long night, if it were only a night; but Scrooge had his doubts of this, because the Christmas Holidays appeared to be condensed into the space of time they passed together.""",-0.192935908285322,-0.192935908285322,-0.385871816570645,-0.385871816570645,0,-0.0260677849416613,0.150061261999695
"924","923,""It was strange, too, that while Scrooge remained unaltered in his outward form, the Ghost grew older, clearly older.""",-0.137649440322337,-0.137649440322337,0,0,0.229415733870562,0.343894185071972,0
"925","924,""Scrooge had observed this change, but never spoke of it, until they left a children's Twelfth Night party, when, looking at the Spirit as they stood together in an open place, he noticed that its hair was grey.""",0.0811107105653813,0.0811107105653813,0,0,0.527219618674978,0.315520664099333,-0.0168980647011211
"926","925,""""""Are spirits' lives so short?"""" asked Scrooge.""",0,0,0,0,0,-0.192761881234706,-0.113389341902768
"927","926,""""""My life upon this globe, is very brief,"""" replied the Ghost.""",-0.180906806746658,-0.180906806746658,0,0,0,-0.25803340868965,-0.0376889180722205
"928","927,""""""It ends to-night.""""""",0,0,0,0,0,-0.275,0
"929","928,""""""To-night!"""" cried Scrooge.""",-0.5,-0.5,0,0,0,-0.275,0
"930","929,""""""To-night at midnight. Hark! The time is drawing near.""""""",0,0,0,0,0,0.246657657493134,0.197642353760524
"931","930,The chimes were ringing the three quarters past eleven at that moment.",0,0,0,0,0,0.0225166604983954,0.0721687836487032
"932","931,""""""Forgive me if I am not justified in what I ask,"""" said Scrooge, looking intently at the Spirit's robe, """"but I see something strange, and not belonging to yourself, protruding from your skirts. Is it a foot or a claw?""""""",-0.509917272702151,-0.509917272702151,-0.355756236768943,0,-0.316227766016838,-0.113446711058541,-0.106726871030683
"933","932,""""""It might be a claw, for the flesh there is upon it,"""" was the Spirit's sorrowful reply.""",-0.32742309379905,-0.32742309379905,-0.242535625036333,0,-0.485071250072666,0.194271035654103,-0.0606339062590832
"934","933,""""""Look here.""""""",0,0,0,0,0,0.0431335136523794,0.0294627825494395
"935","934,""From the foldings of its robe, it brought two children; wretched, abject, frightful, hideous, miserable.""",-0.968245836551854,-0.968245836551854,-1.03279555898864,0,-1.29099444873581,-0.59385744641847,-1.00052069777025
"936","935,""They knelt down at its feet, and clung upon the outside of its garment.""",0,0,0,0,0,-0.256303530994015,-0.0417595690488163
"937","936,""""""Oh, Man! look here. Look, look, down here!"""" exclaimed the Ghost.""",-0.180906806746658,-0.180906806746658,0,0,0,-0.225228974399589,-0.00942222951805512
"938","937,They were a boy and girl.",0.102062072615966,0.102062072615966,0,0,-0.408248290463863,0.258421167863625,0
"939","938,""Yellow, meagre, ragged, scowling, wolfish; but prostrate, too, in their humility.""",-0.376889180722205,-0.376889180722205,0,0,0.301511344577764,-0.654581129078325,-0.838578427106905
"940","939,""Where graceful youth should have filled their features out, and touched them with its freshest tints, a stale and shrivelled hand, like that of age, had pinched, and twisted them, and pulled them into shreds.""",0.152127765851133,0.329610159344121,-0.00845154254728517,0,0,-0.0059160797830996,0.0704295212273764
"941","940,""Where angels might have sat enthroned, devils lurked, and glared out menacing.""",-0.66395280956807,-0.66395280956807,-0.288675134594813,0,-0.288675134594813,-0.204093320158533,-0.396928310067868
"942","941,""No change, no degradation, no perversion of humanity, in any grade, through all the mysteries of wonderful creation, has monsters half so horrible and dread.""",0.1,0.1,0.2,0.2,0,0.3804,-0.115
"943","942,""Scrooge started back, appalled.""",-0.25,-0.25,-0.5,0,0,0.4115,0.25
"944","943,""Having them shown to him in this way, he tried to say they were fine children, but the words choked themselves, rather than be parties to a lie of such enormous magnitude.""",-0.441941738241592,-0.441941738241592,0,-0.176776695296637,-0.57452425971407,0.103944696834423,-0.0939126193763383
"945","944,""""""Spirit! are they yours?""""""",0.25,0.25,0,0,0.5,0.2735,0.1875
"946","945,Scrooge could say no more.",0,0,0,0,0,-0.0550967149655948,0.0279508497187474
"947","946,""""""They are Man's,"""" said the Spirit, looking down upon them.""",0.158113883008419,0.158113883008419,0,0,0.316227766016838,0.284288761649137,0.148231765320393
"948","947,""""""And they cling to me, appealing from their fathers. This boy is Ignorance. This girl is Want. Beware them both, and all of their degree, but most of all beware this boy, for on his brow I see that written which is Doom, unless the writing be erased. Deny it!"""" cried the Spirit, stretching out its hand towards the city.""",-0.505101578067884,-0.505101578067884,-0.781051641485162,-0.129099444873581,-1.17480494834958,0.153725163983216,0.492191633580526
"949","948,""""""Slander those who tell it ye! Admit it for your factious purposes, and make it worse. And bide the end!""""""",-0.145344418537486,-0.145344418537486,-0.447213595499958,-0.447213595499958,-0.447213595499958,-0.131033583481488,0.112697826065989
"950","949,""""""Have they no refuge or resource?"""" cried Scrooge.""",0,0,0,0,0,-0.480479057816259,0.309359216769115
"951","950,""""""Are there no prisons?"""" said the Spirit, turning on him for the last time with his own words.""",-0.117851130197758,-0.117851130197758,0,0,-0.471404520791032,0.256208357049926,0.00982092751647983
"952","951,""""""Are there no workhouses?""""""",0,0,0,0,0,0,0
"953","952,The bell struck twelve.",-0.25,-0.25,-0.5,0,0,0.0035,-0.1875
"954","953,""Scrooge looked about him for the Ghost, and saw it not.""",-0.180906806746658,-0.180906806746658,0,0,0,-0.16854484161897,0.0376889180722205
"955","954,""As the last stroke ceased to vibrate, he remembered the prediction of old Jacob Marley, and lifting up his eyes, beheld a solemn Phantom, draped and hooded, coming, like a mist along the ground, towards him.""",-0.291666666666667,-0.125,-0.333333333333333,-0.166666666666667,-0.333333333333333,-0.167166666666667,0.078125
"956","955,THE LAST OF THE SPIRITS",0.111803398874989,0.111803398874989,0,0,0.447213595499958,0.342565614152968,-0.0931694990624912
"957","956,""THE Phantom slowly, gravely, silently, approached.""",-0.71443450831176,-0.71443450831176,-0.816496580927726,-0.408248290463863,-0.408248290463863,-0.547052709221576,-0.0255155181539914
"958","957,""When it came near him, Scrooge bent down upon his knee; for in the very air through which this Spirit moved it seemed to scatter gloom and mystery.""",-0.296702111312243,-0.296702111312243,-0.869318287921223,0,0,-0.0757062839437482,0.0578758099295379
"959","958,""It was shrouded in a deep black garment, which concealed its head, its face, its form, and left nothing of it visible save one outstretched hand.""",-0.229455878111675,-0.229455878111675,-0.353009043248731,-0.196116135138184,-0.353009043248731,-0.259265530652679,-0.437584126527073
"960","959,""But for this it would have been difficult to detach its figure from the night, and separate it from the darkness by which it was surrounded.""",-0.831042122648055,-0.367717753384095,-1.10070180846306,-0.441261304060914,-0.196116135138184,0.00220630652030452,-0.429004045614778
"961","960,""He felt that it was tall and stately when it came beside him, and that its mysterious presence filled him with a solemn dread.""",-0.0510310363079829,-0.0510310363079829,-0.408248290463863,0,0.204124145231932,0.301287238362331,0.17860862707794
"962","961,""He knew no more, for the Spirit neither spoke nor moved.""",-0.150755672288882,-0.150755672288882,0,0,-0.603022689155527,0.0072362722698663,-0.131911213252772
"963","962,""""""I am in the presence of the Ghost of Christmas Yet To Come?"""" said Scrooge.""",-0.0516397779494322,-0.0516397779494322,0,0,0.258198889747161,0.0942425947577138,-0.0107582870727984
"964","963,""The Spirit answered not, but pointed onward with its hand.""",-0.158113883008419,-0.158113883008419,0,0,-0.316227766016838,0.303736769259173,-0.118585412256314
"965","964,""""""You are about to show me shadows of the things that have not happened, but will happen in the time before us,"""" Scrooge pursued.""",-0.0510310363079829,-0.0510310363079829,0,0,0,0.556289326793321,0.133956470308455
"966","965,""""""Is that so, Spirit?""""""",0.25,0.25,0,0,0.5,0.2735,0.1875
"967","966,""The upper portion of the garment was contracted for an instant in its folds, as if the Spirit had inclined its head.""",0.0852802865422442,0.0852802865422442,0,0,0,0.324704691009595,-0.0133250447722257
"968","967,That was the only answer he received.",0.0453557367611073,0.0453557367611073,0,0,0.0755928946018454,0.10771987480763,0.00472455591261534
"969","968,""Although well used to ghostly company by this time, Scrooge feared the silent shape so much that his legs trembled beneath him, and he found that he could hardly stand when he prepared to follow it.""",0.529166666666667,0.229166666666667,0.675,0,0.125,0.138833333333333,0.0906416666666667
"970","969,""The Spirit paused a moment, as observing his condition, and giving him time to recover.""",0.451848057057532,0.451848057057532,0.258198889747161,0,0.516397779494322,0.799125563767464,0.209786597919568
"971","970,But Scrooge was all the worse for this.",-0.265165042944955,-0.265165042944955,-0.353553390593274,-0.353553390593274,-0.353553390593274,0.119501046020526,0.160513239329346
"972","971,""It thrilled him with a vague uncertain horror, to know that behind the dusky shroud, there were ghostly eyes intently fixed upon him, while he, though he stretched his own to the utmost, could see nothing but a spectral hand and one great heap of black.""",-0.285668790050113,-0.285668790050113,0.0368604890387243,0.331744401348519,-1.25325662731663,-0.305784591012238,-0.406587781317196
"973","972,""""""Ghost of the Future!"""" he exclaimed, """"I fear you more than any spectre I have seen. But as I know your purpose is to do me good, and as I hope to live to be another man from what I was, I am prepared to bear you company, and do it with a thankful heart. Will you not speak to me?""""""",0.395217839132867,0.395217839132867,0.415991822901979,0.287954942969083,0.672065582767771,1.08401950658731,0.288709827073687
"974","973,It gave him no reply.",0,0,0,0,0,-0.249992399884476,0.111803398874989
"975","974,The hand was pointed straight before them.",0.226778683805536,0.226778683805536,0,0,0,0.359444213831775,-0.0188982236504614
"976","975,""""""Lead on!"""" said Scrooge.""",0.125,0.125,0.5,0,0.5,0.352,0.1875
"977","976,""""""Lead on! The night is waning fast, and it is precious time to me, I know. Lead on, Spirit!""""""",0.48177304112818,0.252357307257618,0.688247201611685,0,0.917662935482247,0.721512483022917,0.59504705972677
"978","977,The Phantom moved away as it had come towards him.",-0.158113883008419,-0.158113883008419,0,0,-0.316227766016838,-0.372516308367835,-0.138349647632367
"979","978,""Scrooge followed in the shadow of its dress, which bore him up, he thought, and carried him along.""",-0.176776695296637,-0.176776695296637,-0.235702260395516,0,-0.235702260395516,-0.13458599068584,0.0338821999318554
"980","979,""They scarcely seemed to enter the city; for the city rather seemed to spring up about them, and encompass them of its own act.""",-0.102062072615966,-0.102062072615966,-0.204124145231932,0,-0.204124145231932,-0.0542970226316938,0.108440952154464
"981","980,""But there they were, in the heart of it; on 'Change, amongst the merchants; who hurried up and down, and chinked the money in their pockets, and conversed in groups, and looked at their watches, and trifled thoughtfully with their great gold seals; and so forth, as Scrooge had seen them often.""",0.325886365282322,0.325886365282322,0.416025147168922,0.138675049056307,0.138675049056307,0.28802807688995,0.173343811320384
"982","981,The Spirit stopped beside one little knot of business men.",0.0316227766016838,0.0316227766016838,0,-0.316227766016838,0.316227766016838,0.0995485007421006,0.110679718105893
"983","982,""Observing that the hand was pointed to them, Scrooge advanced to listen to their talk.""",0.296928723209235,0.296928723209235,0.258198889747161,0,0.516397779494322,0.0895950147422649,0.0645497224367903
"984","983,""""""No,"""" said a great fat man with a monstrous chin, """"I don't know much about it, either way. I only know he's dead.""""""",-0.145960089839952,-0.145960089839952,-0.25021729686849,0.208514414057075,-0.208514414057075,-0.0895777922789193,0.0573414638656956
"985","984,""""""When did he die?"""" inquired another.""",-0.306186217847897,-0.306186217847897,-0.408248290463863,0,-0.408248290463863,-0.0938971068066885,-0.0850517271799715
"986","985,""""""Last night, I believe.""""""",0,0,0,0,0,-0.1115,-0.0208333333333333
"987","986,""""""Why, what was the matter with him?"""" asked a third, taking a vast quantity of snuff out of a very large snuff-box.""",0,0,0,0,0,-0.0266898449993056,-0.0208514414057075
"988","987,""""""I thought he'd never die.""""""",0.335410196624968,0.335410196624968,0.447213595499958,0,0.447213595499958,-0.151605408874486,0.0931694990624912
"989","988,""""""God knows,"""" said the first, with a yawn.""",-0.0883883476483184,-0.0883883476483184,-0.353553390593274,0,0,0.227688383542068,0.132582521472478
"990","989,""""""What has he done with his money?"""" asked a red-faced gentleman with a pendulous excrescence on the end of his nose, that shook like the gills of a turkey-cock.""",0.332269808749534,0.332269808749534,0.179605302026775,0,0.35921060405355,0.0361006657073817,0.0449013255066937
"991","990,""""""I haven't heard,"""" said the man with the large chin, yawning again.""",0,0,0,0,-0.288675134594813,-0.0964174949546675,-0.108253175473055
"992","991,""""""Left it to his company, perhaps. He hasn't left it to me. That's all I know.""""""",0,0,0,0,0,0.06625,-0.171875
"993","992,This pleasantry was received with a general laugh.",0.530330085889911,0.530330085889911,0,0,1.06066017177982,0.785949187288847,0.397747564417433
"994","993,""""""It's likely to be a very cheap funeral,"""" said the same speaker; """"for upon my life I don't know of anybody to go to it. Suppose we make up a party and volunteer?""""""",-0.546603839700891,-0.546603839700891,-0.313339780720256,0,-0.487417436675954,-0.0625635095504778,-0.340902076246575
"995","994,""""""I don't mind going if a lunch is provided,"""" observed the gentleman with the excrescence on his nose.""",0.235702260395516,0.235702260395516,0,0,0.235702260395516,0.179605122421383,0.147313912747197
"996","995,""""""But I must be fed, if I make one.""""""",0,0,0,0,0,-0.217,0.1
"997","996,Another laugh.",0.353553390593274,0.353553390593274,0,0,0.707106781186547,0.608111831820431,0.265165042944955
"998","997,""""""Well, I am the most disinterested among you, after all,"""" said the first speaker, """"for I never wear black gloves, and I never eat lunch. But I' offer to go, if anybody else will. When I come to think of it, I' not at all sure that I wasn't his most particular friend; for we used to stop and speak whenever we met. Bye, bye!""""""",0.27838355831202,0.27838355831202,-0.0992277876713668,-0.223262522260575,0.167322856960842,1.18836748949411,0.181578582456295
"999","998,""Speakers and listeners strolled away, and mixed with other groups.""",0.126491106406735,0.126491106406735,0,0,0,-0.385797874540542,-0.0988211768802618
"1000","999,""Scrooge knew the men, and looked towards the Spirit for an explanation.""",0.144337567297406,0.144337567297406,0,0,0.288675134594813,0.374988999838662,0.144337567297406
"1001","1000,The Phantom glided on into a street.",-0.188982236504614,-0.188982236504614,0,0,-0.377964473009227,-0.27893778108081,0.0944911182523068
"1002","1001,Its finger pointed to two persons meeting.",0,0,0,0,0,0.385145797996403,-0.0472455591261534
"1003","1002,""Scrooge listened again, thinking that the explanation might lie here.""",-0.158113883008419,-0.158113883008419,-0.316227766016838,-0.316227766016838,-0.316227766016838,0.132815661727072,-0.0790569415042095
"1004","1003,""He knew these men, also, perfectly.""",0.204124145231932,0.204124145231932,0.408248290463863,0.408248290463863,0,0.259645912735017,0.153093108923949
"1005","1004,""They were men of business: very wealthy, and of great importance.""",0.572871554697751,0.572871554697751,0.844231764817738,0.301511344577764,0.301511344577764,0.656088685801214,0.0376889180722205
"1006","1005,""He had made a point always of standing well in their esteem: in a business point of view, that is; strictly in a business point of view.""",0.1539600717839,0.1539600717839,0,0,0.384900179459751,0.737661193934612,0.489419823192046
"1007","1006,""""""How are you?"""" said one.""",0,0,0,0,0,-0.339882332579968,0
"1008","1007,""""""How are you?"""" returned the other.""",0,0,0,0,0,0,0
"1009","1008,""""""Well!"""" said the first.""",0.4,0.4,0.5,0,0,0.4185,0.4278
"1010","1009,""""""Old Scratch has got his own at last, hey?""""""",-0.2,-0.2,-0.333333333333333,0,0,-0.432666666666667,-0.152777777777778
"1011","1010,""""""So I am told,"""" returned the second.""",0,0,0,0,0,0.00944911182523068,-0.0944911182523068
"1012","1011,""""""Cold, isn't it?""""""",-0.288675134594813,-0.288675134594813,-0.577350269189626,0,-0.577350269189626,0.0790969868789787,-0.126295371385231
"1013","1012,""""""Seasonable for Christmas time. You're not a skater, I suppose?""""""",0,0,0,0,0,-1.09256693158817,-0.131761569173682
"1014","1013,""""""No. No. Something else to think of. Good morning!""""""",0.25,0.25,0.333333333333333,0.333333333333333,0.333333333333333,0.361333333333333,0.239583333333333
"1015","1014,Not another word.",0,0,0,0,0.577350269189626,0,0
"1016","1015,""That was their meeting, their conversation, and their parting.""",0,0,0,0,0,0.395666666666667,-0.0416666666666667
"1017","1016,""Scrooge was at first inclined to be surprised that the Spirit should attach importance to conversations apparently so trivial; but feeling assured that they must have some hidden purpose, he set himself to consider what it was likely to be.""",0.567628840000224,0.567628840000224,-0.158113883008419,0.482247343175678,0.316227766016838,0.585045084213601,0.280652142339944
"1018","1017,""They could scarcely be supposed to have any bearing on the death of Jacob, his old partner, for that was Past, and this Ghost's province was the Future.""",-0.0850420064270761,-0.0850420064270761,-0.377964473009227,0,-0.188982236504614,-0.0725691788177716,-0.106302508033845
"1019","1018,""Nor could he think of any one immediately connected with himself, to whom he could apply them.""",0,0,0,0,0,0.0426862700063946,-0.0303169531295416
"1020","1019,""But nothing doubting that to whomsoever they applied they had some latent moral for his own improvement, he resolved to treasure up every word he heard, and everything he saw; and especially to observe the shadow of himself when it appeared.""",0.245973674974555,0.245973674974555,0.50756472613797,0.351390964249364,0.312347523777212,0.390692091428631,0.280136685387687
"1021","1020,""For he had an expectation that the conduct of his future self would give him the clue he missed, and would render the solution of these riddles easy.""",0.151185789203691,0.151185789203691,0,0,0.566946709513841,0.319757944165806,0.157485197087178
"1022","1021,""He looked about in that very place for his own image; but another man stood in his accustomed corner, and though the clock pointed to his usual time of day for being there, he saw no likeness of himself among the multitudes that poured in through the Porch.""",0.0577350269189626,0.0577350269189626,0,0,0.144337567297406,0.281515991256862,0.273038564804261
"1023","1022,""It gave him little surprise, however; for he had been revolving in his mind a change of life, and thought and hoped he saw his new-born resolutions carried out in this.""",0.162634559672906,0.162634559672906,0,0,0.0353553390593274,0.313036172031285,-0.0195190934390037
"1024","1023,""Quiet and dark, beside him stood the Phantom, with its outstretched hand.""",-0.245373864405591,-0.245373864405591,0,0,0,0.0150111069989303,-0.210492285642051
