"","sent_raw","jockers_rinker","jockers","huliu","lmcd","nrc","senticnet","sentiword"
"1","0,MARLEY'S GHOST",-0.424264068711928,-0.424264068711928,0,0,0,-0.424264068711928,-0.0883883476483184
"2","1,MARLEY was dead: to begin with.",-0.408248290463863,-0.408248290463863,-0.408248290463863,0,0,-0.148602377728846,-0.102062072615966
"3","2,There is no doubt whatever about that.",0.28347335475692,0.28347335475692,0.377964473009227,0.377964473009227,0.377964473009227,-0.160256936555912,-0.28347335475692
"4","3,""The register of his burial was signed by the clergyman, the clerk, the undertaker, and the chief mourner.""",-0.353553390593274,-0.353553390593274,-0.235702260395516,0,-0.235702260395516,0.348839345385363,-0.0294627825494395
"5","4,""Scrooge signed it: and Scrooge's name was good upon 'Change, for anything he chose to put his hand to.""",0.172061800402921,0.172061800402921,0.229415733870562,0.229415733870562,0.229415733870562,0.460437377878217,0.145774580896919
"6","5,Old Marley was as dead as a door-nail.",-0.333333333333333,-0.333333333333333,-0.333333333333333,0,0,-0.130666666666667,-0.25
"7","6,Mind!",0,0,0,0,0,0,0
"8","7,""I don't mean to say that I know, of my own knowledge, what there is particularly dead about a door-nail.""",-0.261861468283191,-0.261861468283191,-0.392792202424786,0,0.218217890235992,-0.289051417406596,-0.193668377584443
"9","8,""I might have been inclined, myself, to regard a coffin-nail as the deadest piece of ironmongery in the trade.""",0.178885438199983,-0.0447213595499958,0.223606797749979,0,-0.223606797749979,0.286887521513223,-0.0349385621484342
"10","9,""But the wisdom of our ancestors is in the simile; and my unhallowed hands shall not disturb it, or the Country's done for.""",0.573414638656956,0.573414638656956,0.677671845685493,0.208514414057075,0.469157431628418,0.549070580815792,-0.0521286035142687
"11","10,""You will therefore permit me to repeat, emphatically, that Marley was as dead as a door-nail.""",-0.303169531295416,-0.303169531295416,-0.485071250072666,0,0,-0.172685365025869,-0.18190171877725
"12","11,Scrooge knew he was dead?",-0.447213595499958,-0.447213595499958,-0.447213595499958,0,0,-0.223606797749979,-0.111803398874989
"13","12,Of course he did.",0,0,0,0,0,-0.415,0
"14","13,How could it be otherwise?",0,0,0,0,0,0,0.139754248593737
"15","14,Scrooge and he were partners for I don't know how many years.",0,0,0,0,0,-0.369215497146766,-0.0541265877365274
"16","15,""Scrooge was his sole executor, his sole administrator, his sole assign, his sole residuary legatee, his sole friend, and sole mourner.""",-0.0436435780471985,-0.0436435780471985,-0.218217890235992,0,0.218217890235992,0.935718313331935,0.163663417676994
"17","16,""And even Scrooge was not so dreadfully cut up by the sad event, but that he was an excellent man of business on the very day of the funeral, and solemnised it with an undoubted bargain.""",0.435,0.435,1.00833333333333,0.675,0.841666666666667,0.52745,0.868402777777778
"18","17,The mention of Marley's funeral brings me back to the point I started from.",-0.21380899352994,-0.21380899352994,0,0,0,0.121603865070153,0.183742103814792
"19","18,There is no doubt that Marley was dead.",0.618718433538229,0.618718433538229,0.707106781186547,0.353553390593274,0.353553390593274,0.240416305603426,-0.0883883476483184
"20","19,""This must be distinctly understood, or nothing wonderful can come of the story I am going to relate.""",0.176776695296637,0.176776695296637,0.235702260395516,0,0.235702260395516,-0.0685893577750951,-0.0687464926153588
"21","20,""If we were not perfectly convinced that Hamlet's Father died before the play began, there would be nothing more remarkable in his taking a stroll at night, in an easterly wind, upon his own ramparts, than there would be in any other middle-aged gentleman rashly turning out after dark in a breezy spot--say Saint Paul's Churchyard for instance-- literally to astonish his son's weak mind.""",-0.18814094430871,0.171037222098827,-0.139273166566188,-0.24433888871261,0.46424388855396,-0.157940657663831,-0.0725381075865562
"22","21,Scrooge never painted out Old Marley's name.",0,0,0,0,0,0.774827169668916,-0.0157485197087178
"23","22,""There it stood, years afterwards, above the warehouse door: Scrooge and Marley.""",0,0,0,0,0,0.174071106160672,0
"24","23,The firm was known as Scrooge and Marley.",0,0,0,0,0,0.199050558904013,-0.0441941738241592
"25","24,""Sometimes people new to the business called Scrooge Scrooge, and sometimes Marley, but he answered to both names.""",0.188561808316413,0.188561808316413,0,0,0,0.210953523053987,-0.0392837100659193
"26","25,It was all the same to him.",0,0,0,0,0,0.306529187610483,-0.14173667737846
"27","26,""But he was a tight-fisted hand at the grind-stone, Scrooge! a squeezing, wrenching, grasping, scraping, clutching, covetous, old sinner!""",-0.624648710800528,-0.624648710800528,-0.709208143266975,0,-0.927426033502968,0.271681273343811,0.184121344886619
"28","27,""Hard and sharp as flint, from which no steel had ever struck out generous fire; secret, and self-contained, and solitary as an oyster.""",0.153093108923949,-0.0510310363079829,0,0,-0.204124145231932,-0.218004587107703,0.0102062072615966
"29","28,""The cold within him froze his old features, nipped his pointed nose, shrivelled his cheek, stiffened his gait; made his eyes red, his thin lips blue; and spoke out shrewdly in his grating voice.""",-0.403021675084896,-0.231523089942387,-0.514495755427526,0,-0.514495755427526,-0.528730137994355,-0.226878336594777
"30","29,""A frosty rime was on his head, and on his eyebrows, and his wiry chin.""",0,0,0,0,0,-0.322748612183951,-0.129099444873581
"31","30,He carried his own low temperature always about with him; he iced his office in the dog-days; and didn't thaw it one degree at Christmas.",0,0,0,0,-0.196116135138184,0.203372432138297,-0.134829842907502
"32","31,External heat and cold had little influence on Scrooge.",-0.0333333333333333,-0.0333333333333333,-0.0666666666666667,0,-0.0666666666666667,-0.216466666666667,0.01875
"33","32,""No warmth could warm, no wintry weather chill him.""",-0.3,-0.3,-0.333333333333333,0,0,0.132333333333333,0.0625
"34","33,""No wind that blew was bitterer than he, no falling snow was more intent upon its purpose, no pelting rain less open to entreaty.""",0.000153093108923949,0.000153093108923949,0.000204124145231932,0,0.000204124145231932,0.0645175185834566,0.0849326547619195
"35","34,Foul weather didn't know where to have him.",0,0,0,0,0,-0.0427799602617861,0.110485434560398
"36","35,""The heaviest rain, and snow, and hail, and sleet, could boast of the advantage over him in only one respect.""",0.167705098312484,0.167705098312484,0.491934955049954,0.223606797749979,0.0447213595499958,0.588220042161095,0.245967477524977
"37","36,""They often """"came down"""" handsomely, and Scrooge never did.""",0.333333333333333,0.333333333333333,0.333333333333333,0,0,-0.103333333333333,0.177083333333333
"38","37,""Nobody ever stopped him in the street to say, with gladsome looks, """"My dear Scrooge, how are you? When will you come to see me?""""""",0.18,0.18,0,0.2,0.2,0.0996,0.04
"39","38,""No beggars implored him to bestow a trifle, no children asked him what it was o'clock, no man or woman ever once in all his life inquired the way to such and such a place, of Scrooge.""",0.0164398987305357,0.0164398987305357,0,0,0.164398987305357,-0.381076852573818,-0.0205498734131697
"40","39,""Even the blind men's dogs appeared to know him; and when they saw him coming on, would tug their owners into doorways and up courts; and then would wag their tails as though they said, """"No eye at all is better than an evil eye, dark master!""""""",-0.0583459965991578,-0.204210988097052,-0.145864991497895,-0.145864991497895,0.145864991497895,-0.0322361631210347,-0.00577382258012499
"41","40,But what did Scrooge care!",0.447213595499958,0.447213595499958,0,0,0,0.42172242055646,-0.0559016994374947
"42","41,It was the very thing he liked.",0.340168025708305,0.340168025708305,0.680336051416609,0,0,0.351733738582387,-0.0850420064270761
"43","42,""To edge his way along the crowded paths of life, warning all human sympathy to keep its distance, was what the knowing ones call """"nuts"""" to Scrooge.""",-0.0962250448649376,-0.0962250448649376,-0.384900179459751,-0.192450089729875,0.384900179459751,0.233249508752609,-0.180421959121758
"44","43,""Once upon a time--of all the good days in the year, on Christmas Eve--old Scrooge sat busy in his counting-house.""",0.156385810542806,0.156385810542806,0.208514414057075,0.208514414057075,0.208514414057075,0.0667246124982639,0.410512752674866
"45","44,""It was cold, bleak, biting weather: foggy withal: and he could hear the people in the court outside, go wheezing up and down, beating their hands upon their breasts, and stamping their feet upon the pavement stones to warm them.""",-0.632455532033676,-0.316227766016838,-0.474341649025257,0,-0.474341649025257,-0.5840726838331,0.0148231765320393
"46","45,""The city clocks had only just gone three, but it was quite dark already-- it had not been light all day--and candles were flaring in the windows of the neighbouring offices, like ruddy smears upon the palpable brown air.""",0.216616019721534,0.216616019721534,0.387379013370626,0,0,-0.0531104533025279,-0.0270934726613385
"47","46,""The fog came pouring in at every chink and keyhole, and was so dense without, that although the court was of the narrowest, the houses opposite were mere phantoms.""",-0.185695338177052,0,-0.185695338177052,0,0,-0.210485665823688,0.16248342090492
"48","47,""To see the dingy cloud come drooping down, obscuring everything, one might have thought that Nature lived hard by, and was brewing on a large scale.""",-0.215727748652002,-0.215727748652002,-0.392232270276368,0,-0.196116135138184,-0.462637962790976,-0.522976360368491
"49","48,""The door of Scrooge's counting-house was open that he might keep his eye upon his clerk, who in a dismal little cell beyond, a sort of tank, was copying letters.""",-0.0628618557093712,-0.0269407953040162,-0.07184212081071,-0.035921060405355,-0.035921060405355,0.283093877054603,-0.214029651581907
"50","49,""Scrooge had a very small fire, but the clerk's fire was so very much smaller that it looked like one coal.""",0.199123824840343,0.199123824840343,0.840138877408571,0,-0.392792202424786,-1.72479420442528,-0.257769882841266
"51","50,""But he couldn't replenish it, for Scrooge kept the coal-box in his own room; and so surely as the clerk came in with the shovel, the master predicted that it would be necessary for them to part.""",-0.300109629091911,-0.291998558035373,-0.00811107105653813,0,-0.202776776413453,0.489551804688415,0.125721601376341
"52","51,""Wherefore the clerk put on his white comforter, and tried to warm himself at the candle; in which effort, not being a man of a strong imagination, he failed.""",-0.0185695338177052,-0.0185695338177052,-0.185695338177052,-0.371390676354104,0.371390676354104,0.173810836533721,-0.0251462437114758
"53","52,""""""A merry Christmas, uncle! God save you!"""" cried a cheerful voice.""",0.376889180722205,0.376889180722205,0.603022689155527,0,1.20604537831105,0.883428239612847,0.226133508433323
"54","53,""It was the voice of Scrooge's nephew, who came upon him so quickly that this was the first intimation he had of his approach.""",0.204124145231932,0,0.204124145231932,0,0,-0.120024997396376,0.0765465544619743
"55","54,""""""Bah!"""" said Scrooge, """"Humbug!""""""",-0.125,-0.125,0,0,-0.5,-0.625,-0.0625
"56","55,""He had so heated himself with rapid walking in the fog and frost, this nephew of Scrooge's, that he was all in a glow; his face was ruddy and handsome; his eyes sparkled, and his breath smoked again.""",0.324442842261525,0.162221421130763,0.324442842261525,0,0.162221421130763,0.312438457097849,-0.0337961294022422
"57","56,""""""Christmas a humbug, uncle!"""" said Scrooge's nephew.""",-0.0944911182523068,-0.0944911182523068,0,0,-0.377964473009227,0.0506472393832365,-0.0472455591261534
"58","57,""""""You don't mean that, I am sure?""""""",0,0,0,0,0,-0.219597358818361,-0.0472455591261534
"59","58,""""""I do,"""" said Scrooge.""",0,0,0,0,0,0.2585,0.0625
"60","59,""""""Merry Christmas! What right have you to be merry? What reason have you to be merry? You're poor enough.""""""",0.83736742862755,0.83736742862755,0.917662935482247,-0.229415733870562,0.917662935482247,1.20672676015915,-0.229415733870562
"61","60,""""""Come, then,"""" returned the nephew gaily.""",0.408248290463863,0.408248290463863,0.408248290463863,0,0,0.370689447741188,0.289175872411903
"62","61,""""""What right have you to be dismal? What reason have you to be morose? You're rich enough.""""""",0.2182820625327,0.2182820625327,0.485071250072666,-0.242535625036333,0,0.576992251961436,-0.116214986996576
"63","62,""Scrooge having no better answer ready on the spur of the moment, said, """"Bah!"""" again; and followed it up with """"Humbug.""""""",-0.403703096936586,-0.403703096936586,-0.436435780471985,-0.218217890235992,-0.218217890235992,-0.39912052124163,-0.184121344886619
"64","63,""""""Don't be cross, uncle!"""" said the nephew.""",0,0,0,0,0.377964473009227,0.156855256298829,0.28347335475692
"65","64,""""""What else can I be,"""" returned the uncle, """"when I live in such a world of fools as this? Merry Christmas! Out upon merry Christmas! What's Christmas time to you but a time for paying bills without money; a time for finding yourself a year older, but not an hour richer; a time for balancing your books and having every item in 'em through a round dozen of months presented dead against you? If I could work my will,"""" said Scrooge indignantly, """"every idiot who goes about with 'Merry Christmas' on his lips, should be boiled with his own pudding, and buried with a stake of holly through his heart. He should!""""""",-0.29514300786108,-0.29514300786108,-0.401398270335799,-0.0944911182523068,0.0238117617995813,0.419046470982901,0.330789782221763
"66","65,""""""Uncle!"""" pleaded the nephew.""",-0.2,-0.2,0,-0.5,0,0.2795,0
"67","66,""""""Nephew!"""" returned the uncle sternly, """"keep Christmas in your own way, and let me keep it in mine.""""""",-0.14142135623731,-0.14142135623731,0,0,0,0.271293301715239,-0.412478955692153
"68","67,""""""Keep it!"""" repeated Scrooge's nephew.""",0,0,0,0,0,0.0608210489879943,-0.279508497187474
"69","68,""""""But you don't keep it.""""""",0,0,0,0,0,-0.136847360222987,0.628894118671816
"70","69,""""""Let me leave it alone, then,"""" said Scrooge.""",-0.300520382004283,-0.300520382004283,0,0,-0.353553390593274,-0.13930003589375,-0.0220970869120796
"71","70,""""""Much good may it do you! Much good it has ever done you!""""""",0.915255323771628,0.915255323771628,1.2203404316955,1.2203404316955,1.2203404316955,0.753782096650464,0.662173359243867
"72","71,""""""There are many things from which I might have derived good, by which I have not profited, I dare say,"""" returned the nephew.""",0.156385810542806,0.156385810542806,0.208514414057075,0.208514414057075,0.208514414057075,0.497932420768295,0.175934036860657
"73","72,""""""Christmas among the rest. But I am sure I have always thought of Christmas time, when it has come round--apart from the veneration due to its sacred name and origin, if anything belonging to it can be apart from that--as a good time; a kind, forgiving, charitable, pleasant time; the only time I know of, in the long calendar of the year, when men and women seem by one consent to open their shut-up hearts freely, and to think of people below them as if they really were fellow-passengers to the grave, and not another race of creatures bound on other journeys. And therefore, uncle, though it has never put a scrap of gold or silver in my pocket, I believe that it has done me good, and will do me good; and I say, God bless it!""""""",0.710786610477296,0.710786610477296,0.503508814978013,0.335672543318676,0.990317920925923,1.47500574423633,0.321336528447774
"74","73,The clerk in the Tank involuntarily applauded.",-0.302371578407382,0.0755928946018455,-0.755928946018454,-0.377964473009227,0,0.436926930798667,-0.0472455591261534
"75","74,""Becoming immediately sensible of the impropriety, he poked the fire, and extinguished the last frail spark for ever.""",-0.212132034355964,-0.212132034355964,-0.235702260395516,-0.235702260395516,-0.235702260395516,0.265165042944955,-0.0196418550329597
"76","75,""""""Let me hear another sound from you,"""" said Scrooge, """"and you' keep your Christmas by losing your situation! You're quite a powerful speaker, sir,"""" he added, turning to his nephew.""",0.0456435464587638,0.0456435464587638,0,-0.3286335345031,0.182574185835055,0.557654593214593,-0.190181443578183
"77","76,""""""I wonder you don't go into Parliament.""""""",-0.377964473009227,0,-0.377964473009227,0,0,-0.197675419383826,-0.177170846723075
"78","77,""""""Don't be angry, uncle. Come! Dine with us to-morrow.""""""",0.237170824512628,0.237170824512628,0.316227766016838,0,0.316227766016838,0.504699514562873,0.105409255338946
"79","78,""Scrooge said that he would see him--yes, indeed he did.""",0.241209075662211,0.241209075662211,0,0,0,-0.217691190785145,0.135680105059994
"80","79,""He went the whole length of the expression, and said that he would see him in that extremity first.""",-0.0573539334676404,-0.0573539334676404,0,0,-0.229415733870562,0.485214277136238,0.160591013709393
"81","80,""""""But why?"""" cried Scrooge's nephew.""",-1.00623058987491,-1.00623058987491,0,0,0,0,0
"82","81,""""""Why?""""""",0,0,0,0,0,0,0
"83","82,""""""Why did you get married?"""" said Scrooge.""",0,0,0,0,0,0.510252038562457,-0.028347335475692
"84","83,""""""Because I fell in love.""""""",0.111803398874989,0.111803398874989,0,0,0,0.292924905052472,0.167705098312484
"85","84,""""""Because you fell in love!"""" growled Scrooge, as if that were the only one thing in the world more ridiculous than a merry Christmas.""",0.102062072615966,0.102062072615966,0,0,0,0.145948763840831,0.173505523447142
"86","85,""""""Good afternoon!""""""",0.530330085889911,0.530330085889911,0.707106781186547,0.707106781186547,0.707106781186547,0.490024999362277,0.331456303681194
"87","86,""""""Nay, uncle, but you never came to see me before that happened. Why give it as a reason for not coming now?""""""",0.287820967080074,0.287820967080074,0,0,0.266500895444513,0.421018114623242,0.170560573084488
"88","87,""""""Good afternoon,"""" said Scrooge.""",0.375,0.375,0.5,0.5,0.5,0.3465,0.234375
"89","88,""""""I want nothing from you; I ask nothing of you; why cannot we be friends?""""""",0,0,0,0,0,-0.226182227418513,0.0645497224367903
"90","89,""""""Good afternoon,"""" said Scrooge.""",0.375,0.375,0.5,0.5,0.5,0.3465,0.234375
"91","90,""""""I am sorry, with all my heart, to find you so resolute. We have never had any quarrel, to which I have been a party. But I have made the trial in homage to Christmas, and I' keep my Christmas humour to the last. So A Merry Christmas, uncle!""""""",0.303571428571429,0.303571428571429,0.464285714285714,0,0.607142857142857,1.088682,0.130880952380952
"92","91,""""""Good afternoon!"""" said Scrooge.""",0.375,0.375,0.5,0.5,0.5,0.3465,0.234375
"93","92,""""""And A Happy New Year!""""""",0.693181073024935,0.693181073024935,0.447213595499958,0.447213595499958,0.447213595499958,0.437822109994459,0.204972897937481
"94","93,""""""Good afternoon!"""" said Scrooge.""",0.375,0.375,0.5,0.5,0.5,0.3465,0.234375
"95","94,""His nephew left the room without an angry word, notwithstanding.""",-0.237170824512628,-0.237170824512628,-0.316227766016838,0,0,0.128388473002836,-0.0395284707521047
"96","95,""He stopped at the outer door to bestow the greetings of the season on the clerk, who, cold as he was, was warmer than Scrooge; for he returned them cordially.""",0.0365148371670111,0.0365148371670111,0,-0.182574185835055,-0.182574185835055,0.332832740777306,0.142636082683637
"97","96,""""""There's another fellow,"""" muttered Scrooge; who overheard him: """"my clerk, with fifteen shillings a week, and a wife and family, talking about a merry Christmas. I' retire to Bedlam.""""""",0.111417202906231,0.111417202906231,0,0,0.371390676354104,0.41131517406217,-0.0928476690885259
"98","97,""This lunatic, in letting Scrooge's nephew out, had let two other people in.""",-0.208012573584461,-0.208012573584461,-0.277350098112615,0,-0.277350098112615,-0.543606192300725,-0.10400628679223
"99","98,""They were portly gentlemen, pleasant to behold, and now stood, with their hats off, in Scrooge's office.""",0.242535625036333,0.242535625036333,0.242535625036333,0.242535625036333,0.242535625036333,-0.230651379409553,-0.156637591169298
"100","99,""They had books and papers in their hands, and bowed to him.""",-0.0721687836487032,-0.0721687836487032,0,0,0,0,0.0360843918243516
"101","100,""""""Scrooge and Marley's, I believe,"""" said one of the gentlemen, referring to his list.""",0,0,0,0,0,-0.108508064216444,0.0445435403187374
"102","101,""""""Have I the pleasure of addressing Mr. Scrooge, or Mr. Marley?""""""",0.150755672288882,0.150755672288882,0.301511344577764,0.301511344577764,0,0.375080112654738,-0.0565333771083307
"103","102,""""""Mr. Marley has been dead these seven years,"""" Scrooge replied.""",-0.316227766016838,-0.316227766016838,-0.316227766016838,0,0,-0.149575733325964,-0.0790569415042095
"104","103,""""""He died seven years ago, this very night.""""""",-0.176776695296637,-0.176776695296637,-0.353553390593274,0,0,-0.823779400082328,0
"105","104,""""""We have no doubt his liberality is well represented by his surviving partner,"""" said the gentleman, presenting his credentials.""",-0.137649440322337,-0.137649440322337,0,0.229415733870562,0,-0.454931400265324,0.00445066523708889
"106","105,It certainly was; for they had been two kindred spirits.",0.33203915431768,0.33203915431768,0,0,0.632455532033676,0.385165419008509,0
"107","106,""At the ominous word """"liberality,"""" Scrooge frowned, and shook his head, and handed the credentials back.""",-0.325,-0.325,-0.25,0,0,-0.11675,-0.3125
"108","107,""""""At this festive season of the year, Mr. Scrooge,"""" said the gentleman, taking up a pen, """"it is more than usually desirable that we should make some slight provision for the Poor and destitute, who suffer greatly at the present time. Many thousands are in want of common necessaries; hundreds of thousands are in want of common comforts, sir.""""""",0.130188910980824,0.130188910980824,-0.338491168550142,-0.234340039765483,0.390566732942472,0.240953636443309,-0.035548082143314
"109","108,""""""Are there no prisons?"""" asked Scrooge.""",0,0,0,0,0,0,0
"110","109,""""""Plenty of prisons,"""" said the gentleman, laying down the pen again.""",0.301511344577764,0.301511344577764,0,0,0.301511344577764,-0.138393707161194,0.0282666885541653
"111","110,""""""And the Union workhouses?"""" demanded Scrooge.""",-0.163299316185545,-0.163299316185545,0,0,0,0.0457238085319527,0
"112","111,""""""Are they still in operation?""""""",0,0,0,0,0,-0.42485291572496,-0.0479157423749955
"113","112,""""""They are. Still,"""" returned the gentleman, """"I wish I could say they were not.""""""",-0.267261241912424,0.481070235442364,-0.534522483824849,0,0.267261241912424,0.0809801562994646,0.13840314313322
"114","113,""""""The Treadmill and the Poor Law are in full vigour, then?"""" said Scrooge.""",-0.138675049056307,-0.138675049056307,-0.277350098112615,-0.277350098112615,0.277350098112615,0.237966384180623,0.0173343811320384
"115","114,""""""Both very busy, sir.""""""",0.125,0.125,0,0,0.5,-0.6675,0.225
"116","115,""""""Oh! I was afraid, from what you said at first, that something had occurred to stop them in their useful course,"""" said Scrooge.""",-0.135534369137099,-0.135534369137099,0,0,-0.208514414057075,-0.354057475068913,-0.130321508785672
"117","116,""""""I' very glad to hear it.""""""",0.551135192126215,0.551135192126215,0.734846922834954,0,0.734846922834954,0.327006880661554,0.413351394094661
"118","117,""""""Under the impression that they scarcely furnish Christian cheer of mind or body to the multitude,"""" returned the gentleman, """"a few of us are endeavouring to raise a fund to buy the Poor some meat and drink, and means of warmth. We choose this time, because it is a time, of all others, when Want is keenly felt, and Abundance rejoices. What shall I put you down for?""""""",0.503261421950391,0.503261421950391,0.339549875050866,0.0970142500145332,0.242535625036333,0.401711755747678,0.322926079084834
"119","118,""""""Nothing!""""""",0,0,0,0,0,-0.72,0
"120","119,Scrooge replied.",0,0,0,0,0,0,0
"121","120,""""""You wish to be anonymous?""""""",0.357770876399966,0.357770876399966,0,0,-0.447213595499958,0.241942555165477,0.0279508497187474
"122","121,""""""I wish to be left alone,"""" said Scrooge.""",-0.919238815542512,0.0707106781186548,-0.707106781186547,0,0,0.226627723370288,0.176776695296637
"123","122,""""""Since you ask me what I wish, gentlemen, that is my answer. I don't make merry myself at Christmas and I can't afford to make idle people merry. I help to support the establishments I have mentioned--they cost enough; and those who are badly off must go there.""""""",-0.0357142857142857,0.364285714285714,0.142857142857143,-0.142857142857143,0.285714285714286,0.768714285714286,-0.106746031746032
"124","123,""""""Many can't go there; and many would rather die.""""""",-0.25,-0.25,-0.333333333333333,0,-0.333333333333333,0.106666666666667,-0.152777777777778
"125","124,""""""If they would rather die,"""" said Scrooge, """"they had better do it, and decrease the surplus population. Besides--excuse me--I don't know that.""""""",-0.193917937970335,-0.193917937970335,-0.204124145231932,0.204124145231932,-0.408248290463863,0.126761094189029,0.05953620902598
