"","sent_raw","jockers_rinker","jockers","huliu","lmcd","nrc","senticnet","sentiword"
"694","693,""In time the bells ceased, and the bakers were shut up; and yet there was a genial shadowing forth of all these dinners and the progress of their cooking, in the thawed blotch of wet above each baker's oven; where the pavement smoked as if its stones were cooking too.""",0.212132034355964,0.212132034355964,0.282842712474619,-0.14142135623731,0.282842712474619,0.214536197411999,-0.0265165042944955
"695","694,""""""Is there a peculiar flavour in what you sprinkle from your torch?"""" asked Scrooge.""",-0.0668153104781061,-0.0668153104781061,-0.267261241912424,0,0,0.0446326273993749,-0.033407655239053
"696","695,""""""There is. My own.""""""",0,0,0,0,0,0.0565,0
"697","696,""""""Would it apply to any kind of dinner on this day?"""" asked Scrooge.""",0.0332820117735137,0.0332820117735137,0,0,0.0554700196225229,0.0256271490656056,0.0161787557232358
"698","697,""""""To any kindly given. To a poor one most.""""""",-0.133333333333333,-0.133333333333333,-0.266666666666667,-0.6,0,-0.546666666666667,-0.245833333333333
"699","698,""""""Why to a poor one most?"""" asked Scrooge.""",-0.318198051533946,-0.318198051533946,-0.636396103067893,-0.636396103067893,0,-0.725491557497398,-0.437522320859176
"700","699,""""""Because it needs it most.""""""",0,0,0,0,0,0,0.201246117974981
"701","700,""""""Spirit,"""" said Scrooge, after a moment's thought, """"I wonder you, of all the beings in the many worlds about us, should desire to cramp these people's opportunities of innocent enjoyment.""""""",0.75768287121548,0.575108685380424,0.182574185835055,0.365148371670111,0.182574185835055,0.483456444091227,0.456435464587638
"702","701,""""""I!"""" cried the Spirit.""",-0.25,-0.25,0,0,0.5,0.2735,0.1875
"703","702,""""""You would deprive them of their means of dining every seventh day, often the only day on which they can be said to dine at all,"""" said Scrooge.""",-0.188982236504614,-0.188982236504614,-0.188982236504614,-0.188982236504614,0,-0.173788064689643,0.0685060607329224
"704","703,""""""Wouldn't you?""""""",0,0,0,0,0,0,0
"705","704,""""""I!"""" cried the Spirit.""",-0.25,-0.25,0,0,0.5,0.2735,0.1875
"706","705,""""""You seek to close these places on the Seventh Day?"""" said Scrooge.""",0,0,0,0,0,0.40847531545166,0.134715062810913
"707","706,""""""And it comes to the same thing.""""""",0,0,0,0,0,0.0808843972239746,-0.188982236504614
"708","707,""""""I seek!"""" exclaimed the Spirit.""",0.223606797749979,0.223606797749979,0,0,0.447213595499958,0.268328157299975,0.167705098312484
"709","708,""""""Forgive me if I am wrong. It has been done in your name, or at least in that of your family,"""" said Scrooge.""",-0.0521286035142687,-0.0521286035142687,-0.208514414057075,-0.208514414057075,0,-0.252969687134043,-0.10208518188211
"710","709,""""""There are some upon this earth of yours,"""" returned the Spirit, """"who lay claim to know us, and who do their deeds of passion, pride, ill-will, hatred, envy, bigotry, and selfishness in our name, who are as strange to us and all our kith and kin, as if they had never lived. Remember that, and charge their doings on themselves, not us.""""""",-0.384263880892714,-0.384263880892714,-0.125988157669742,-0.125988157669742,0,0.0154965433933783,0.338593173737433
"711","710,""Scrooge promised that he would; and they went on, invisible, as they had been before, into the suburbs of the town.""",-0.109108945117996,0.109108945117996,0,0,0,-0.172392133286434,-0.0818317088384971
"712","711,""It was a remarkable quality of the Ghost (which Scrooge had observed at the baker's), that notwithstanding his gigantic size, he could accommodate himself to any place with ease; and that he stood beneath a low roof quite as gracefully and like a supernatural creature, as it was possible he could have done in any lofty hall.""",0.31523870098148,0.321861362766806,0.735115458171099,0,0.0264906471413009,0.269489353368454,-0.153149053785646
"713","712,""And perhaps it was the pleasure the good Spirit had in showing off this power of his, or else it was his own kind, generous, hearty nature, and his sympathy with all poor men, that led him straight to Scrooge's clerk's; for there he went, and took Scrooge with him, holding to his robe; and on the threshold of the door the Spirit smiled, and stopped to bless Bob Cratchit's dwelling with the sprinkling of his torch.""",0.672367401111864,0.672367401111864,0.455842305838552,0,0.797724035217466,0.283533914231579,0.0952045649173225
"714","713,Think of that!",0,0,0,0,0,0,0
"715","714,""Bob had but fifteen """"Bob"""" a-week himself; he pocketed on Saturdays but fifteen copies of his Christian name; and yet the Ghost of Christmas Present blessed his four-roomed house!""",0.116743446317404,0.116743446317404,0,0,0.35921060405355,-0.312313863641339,0.174015087001192
"716","715,""Then up rose Mrs. Cratchit, Cratchit's wife, dressed out but poorly in a twice-turned gown, but brave in ribbons, which are cheap and make a goodly show for sixpence; and she laid the cloth, assisted by Belinda Cratchit, second of her daughters, also brave in ribbons; while Master Peter Cratchit plunged a fork into the saucepan of potatoes, and getting the corners of his monstrous shirt collar (Bob's private property, conferred upon his son and heir in honour of the day) into his mouth, rejoiced to find himself so gallantly attired, and yearned to show his linen in the fashionable Parks.""",0.290855840749398,0.0928263321540632,0.297044262893002,-0.222783197169752,-0.0247536885744169,0.292222244358706,-0.027550855383326
"717","716,""And now two smaller Cratchits, boy and girl, came tearing in, screaming that outside the baker's they had smelt the goose, and known it for their own; and basking in luxurious thoughts of sage and onion, these young Cratchits danced about the table, and exalted Master Peter Cratchit to the skies, while he (not proud, although his collars nearly choked him) blew the fire, until the slow potatoes bubbling up, knocked loudly at the saucepan-lid to be let out and peeled.""",-0.194635564706917,-0.0842040386320705,-0.110431526074847,-0.110431526074847,0.220863052149693,-0.184255001255881,0.0276078815187116
"718","717,""""""What has ever got your precious father then?"""" said Mrs. Cratchit.""",0.150755672288882,0.150755672288882,0.301511344577764,0,0.301511344577764,0.21166096389359,0.235555737951378
"719","718,""""""And your brother, Tiny Tim! And Martha warn't as late last Christmas Day by half-an-hour?""""""",0.0363803437554499,0.0363803437554499,0,-0.242535625036333,0,0.221192490033136,-0.161690416690889
"720","719,""""""Here's Martha, mother!"""" said a girl, appearing as she spoke.""",0.0790569415042095,0.0790569415042095,0,0,-0.316227766016838,0.0294091822395659,-0.0395284707521047
"721","720,""""""Here's Martha, mother!"""" cried the two young Cratchits.""",-0.212132034355964,-0.212132034355964,0,0,0.353553390593274,0.186322636842655,-0.0441941738241592
"722","721,""""""Hurrah! There's such a goose, Martha!""""""",0,0,0,0,0.408248290463863,0.22086232514095,-0.102062072615966
"723","722,""""""Why, bless your heart alive, my dear, how late you are!"""" said Mrs. Cratchit, kissing her a dozen times, and taking off her shawl and bonnet for her with officious zeal.""",0.332269808749534,0.332269808749534,0.179605302026775,-0.179605302026775,0.538815906080325,0.124286869002528,0.282504172979615
"724","723,""""""We'd a deal of work to finish up last night,"""" replied the girl, """"and had to clear away this morning, mother!""""""",0.218217890235992,0.218217890235992,0.436435780471985,0,0.218217890235992,-0.148169947470239,0.0616985106322002
"725","724,""""""Well! Never mind so long as you are come,"""" said Mrs. Cratchit.""",-0.23094010767585,-0.23094010767585,-0.288675134594813,0,0,-0.276839454076426,-0.234962314551205
"726","725,""""""Sit ye down before the fire, my dear, and have a warm, Lord bless ye!""""""",0.451848057057532,0.451848057057532,0.516397779494322,0,0.516397779494322,0.40743784802102,-0.0564810071321915
"727","726,""""""No, no! There's father coming,"""" cried the two young Cratchits, who were everywhere at once.""",-0.154919333848297,-0.154919333848297,0,0,0.258198889747161,-0.288666358737326,-0.129099444873581
"728","727,""""""Hide, Martha, hide!""""""",0,0,0,0,0,-0.023094010767585,-0.21650635094611
"729","728,""So Martha hid herself, and in came little Bob, the father, with at least three feet of comforter exclusive of the fringe, hanging down before him; and his threadbare clothes darned up and brushed, to look seasonable; and Tiny Tim upon his shoulder.""",-0.160123498849235,-0.160123498849235,0,0.0304997140665209,0,0.0785367637212914,-0.0127082141943837
"730","729,""Alas for Tiny Tim, he bore a little crutch, and had his limbs supported by an iron frame!""",0.0471404520791032,0.0471404520791032,0.188561808316413,0,0.424264068711929,0.144956890143242,-0.206239477846076
"731","730,""""""Why, where's our Martha?"""" cried Bob Cratchit, looking round.""",-0.333333333333333,-0.333333333333333,0,0,0,0.244,0.0416666666666667
"732","731,""""""Not coming,"""" said Mrs. Cratchit.""",0,0,0,0,0,-0.365820721118966,-0.167705098312484
"733","732,""""""Not coming!"""" said Bob, with a sudden declension in his high spirits; for he had been Tim's blood horse all the way from church, and had come home rampant.""",-0.046423834544263,-0.046423834544263,-0.185695338177052,0,0.519946946895745,0.372059179571541,-0.116059586360657
"734","733,""""""Not coming upon Christmas Day!""""""",0,0,0,0,0,-0.896663258977416,-0.242240697562477
"735","734,""Martha didn't like to see him disappointed, if it were only in joke; so she came out prematurely from behind the closet door, and ran into his arms, while the two young Cratchits hustled Tiny Tim, and bore him off into the wash-house, that he might hear the pudding singing in the copper.""",0.0367423461417477,0.0367423461417477,-0.163299316185545,0,0.108866210790363,-0.15567868143022,-0.0610104389637662
"736","735,""""""And how did little Tim behave?"""" asked Mrs. Cratchit, when she had rallied Bob on his credulity, and Bob had hugged his daughter to his heart's content.""",0.23094010767585,0.23094010767585,0,0,0.384900179459751,-0.0820992082787648,0.0962250448649376
"737","736,""""""As good as gold,"""" said Bob, """"and better. Somehow he gets thoughtful, sitting by himself so much, and thinks the strangest things you ever heard. He told me, coming home, that he hoped the people saw him in the church, because he was a cripple, and it might be pleasant to them to remember upon Christmas Day, who made lame beggars walk, and blind men see.""""""",0.233873832860732,0.233873832860732,0.123091490979333,0.369274472937998,0.369274472937998,0.512429876946962,0.181816389800723
"738","737,""Bob's voice was tremulous when he told them this, and trembled more when he said that Tiny Tim was growing strong and hearty.""",0.456646566784994,0.456646566784994,0.375325945302735,0.375325945302735,0,-0.638179215663083,0.106863637204251
"739","738,""His active little crutch was heard upon the floor, and back came Tiny Tim before another word was spoken, escorted by his brother and sister to his stool before the fire; and while Bob, turning up his cuffs--as if, poor fellow, they were capable of being made more shabby--compounded some hot mixture in a jug with gin and lemons, and stirred it round and round and put it on the hob to simmer; Master Peter, and the two ubiquitous young Cratchits went to fetch the goose, with which they soon returned in high procession.""",0.217392214672007,0.115330142056041,0.183711730708738,-0.102062072615966,0.510310363079829,0.359258495608199,0.0271102380386159
"740","739,""Such a bustle ensued that you might have thought a goose the rarest of all birds; a feathered phenomenon, to which a black swan was a matter of course--and in truth it was something very like it in that house.""",0.2576867071162,0.2576867071162,0.281112771399491,0,0,0.401522741815606,0.0810151389797144
"741","740,""Mrs. Cratchit made the gravy (ready beforehand in a little saucepan) hissing hot; Master Peter mashed the potatoes with incredible vigour; Miss Belinda sweetened up the apple-sauce; Martha dusted the hot plates; Bob took Tiny Tim beside him in a tiny corner at the table; the two young Cratchits set chairs for everybody, not forgetting themselves, and mounting guard upon their posts, crammed spoons into their mouths, lest they should shriek for goose before their turn came to be helped.""",0.0511111111111111,0.0511111111111111,0.133333333333333,0,0.2,0.0523555555555556,0.125694444444444
"742","741,""At last the dishes were set on, and grace was said.""",0.301511344577764,0,0.301511344577764,0,0.301511344577764,0.312064241637985,0.133167510521846
"743","742,""It was succeeded by a breathless pause, as Mrs. Cratchit, looking slowly all along the carving-knife, prepared to plunge it in the breast; but when she did, and when the long expected gush of stuffing issued forth, one murmur of delight arose all round the board, and even Tiny Tim, excited by the two young Cratchits, beat on the table with the handle of his knife, and feebly cried Hurrah!""",-0.0534051746187234,-0.0534051746187234,0.118678165819385,0.237356331638771,0.356034497458156,0.596832495905689,-0.049943728115658
"744","743,There never was such a goose.",0,0,0,0,0,-0.22086232514095,0.102062072615966
"745","744,Bob said he didn't believe there ever was such a goose cooked.",0,0,0,0,0,-0.224877929849359,-0.120281306081172
"746","745,""Its tenderness and flavour, size and cheapness, were the themes of universal admiration.""",0.540832691319598,0.540832691319598,0,0,0.554700196225229,0.300092806157849,0.277350098112615
"747","746,""Eked out by apple-sauce and mashed potatoes, it was a sufficient dinner for the whole family; indeed, as Mrs. Cratchit said with great delight (surveying one small atom of a bone upon the dish), they hadn't ate it all at last!""",0.439764547391962,0.439764547391962,0.308606699924184,0.308606699924184,0.462910049886276,0.197508287951478,-0.25717224993682
"748","747,""Yet every one had had enough, and the youngest Cratchits in particular, were steeped in sage and onion to the eyebrows!""",0.0763762615825973,0.0763762615825973,0.218217890235992,0,0.218217890235992,-0.0977616148257246,0.0545544725589981
"749","748,""But now, the plates being changed by Miss Belinda, Mrs. Cratchit left the room alone--too nervous to bear witnesses--to take the pudding up and bring it in.""",-0.436384044716072,-0.25068870653902,-0.371390676354104,-0.185695338177052,-0.185695338177052,-0.112159984258939,-0.2118087451082
"750","749,Suppose it should not be done enough!",0.0944911182523068,0.0944911182523068,-0.377964473009227,0,0,-0.218841429872343,-0.0472455591261534
"751","750,Suppose it should break in turning out!",-0.0944911182523068,-0.0944911182523068,-0.377964473009227,-0.377964473009227,0,-0.275914065296736,-0.118113897815384
"752","751,""Suppose somebody should have got over the wall of the back-yard, and stolen it, while they were merry with the goose--a supposition at which the two young Cratchits became livid!""",-0.203293199591132,-0.0176776695296637,-0.362392225358106,-0.176776695296637,0,0.353376613897977,-0.191508086571357
"753","752,All sorts of horrors were supposed.",-0.408248290463863,-0.408248290463863,0,0,-0.408248290463863,0,0
"754","753,Hallo!",0,0,0,0,0,0,0
"755","754,A great deal of steam!",0.335410196624968,0.335410196624968,0.447213595499958,0.447213595499958,0.447213595499958,0.448108022690958,0
"756","755,The pudding was out of the copper.",0,0,0,0,0,0.0570726354243933,-0.0944911182523068
"757","756,A smell like a washing-day!",0.102062072615966,0.102062072615966,0,0,-0.408248290463863,0.558483661354565,-0.136082763487954
"758","757,That was the cloth.",0,0,0,0,0,-0.02,0
"759","758,""A smell like an eating-house and a pastrycook's next door to each other, with a laundress's next door to that!""",0.0545544725589981,0.0545544725589981,0,0,-0.218217890235992,-0.150788562153071,-0.109108945117996
"760","759,That was the pudding!",0,0,0,0,0,0.024,-0.0625
"761","760,""In half a minute Mrs. Cratchit entered--flushed, but smiling proudly--with the pudding, like a speckled cannon-ball, so hard and firm, blazing in half of half-a-quartern of ignited brandy, and bedight with Christmas holly stuck into the top.""",0.592139105479528,0.437835755517436,0.347182537414707,0,0.192879187452615,0.124137045044503,0.108976740910727
"762","761,""Oh, a wonderful pudding!""",0.375,0.375,0.5,0,0.5,0.4265,-0.0625
"763","762,""Bob Cratchit said, and calmly too, that he regarded it as the greatest success achieved by Mrs. Cratchit since their marriage.""",0.403703096936586,0.403703096936586,0.436435780471985,0.654653670707977,0.436435780471985,0.323835349110213,0.236402714422325
"764","763,""Mrs. Cratchit said that now the weight was off her mind, she would confess she had had her doubts about the quantity of flour.""",-0.204124145231932,-0.204124145231932,-0.408248290463863,-0.408248290463863,0,0.01796292478041,-0.246650008821917
"765","764,""Everybody had something to say about it, but nobody said or thought it was at all a small pudding for a large family.""",0,0,0,0,0.469157431628418,-0.74700288835947,0.488705657946269
"766","765,It would have been flat heresy to do so.",-0.516666666666667,-0.166666666666667,-0.683333333333333,0,-0.333333333333333,0.0166666666666667,-0.158333333333333
"767","766,Any Cratchit would have blushed to hint at such a thing.",-0.316586911806652,0,-0.316586911806652,0,0,0.403723690389625,-0.0376889180722205
"768","767,""At last the dinner was all done, the cloth was cleared, the hearth swept, and the fire made up.""",0.332652814112315,0.332652814112315,0.229415733870562,0,0.458831467741123,0.148431979814253,0.21746699773147
"769","768,""The compound in the jug being tasted, and considered perfect, apples and oranges were put upon the table, and a shovel-full of chestnuts on the fire.""",0.0962250448649376,0.0962250448649376,0.192450089729875,0.192450089729875,0.384900179459751,0.550792156806903,0.108253175473055
"770","769,""Then all the Cratchit family drew round the hearth, in what Bob Cratchit called a circle, meaning half a one; and at Bob Cratchit's elbow stood the family display of glass.""",0.107763181216065,0.107763181216065,0,0,0.179605302026775,0.047056589131015,0.269407953040162
"771","770,""Two tumblers, and a custard-cup without a handle.""",0,0,0,0,0,0.245666666666667,-0.0833333333333333
"772","771,""These held the hot stuff from the jug, however, as well as golden goblets would have done; and Bob served it out with beaming looks, while the chestnuts on the fire sputtered and cracked noisily.""",-0.0253546276418555,0.152127765851133,0.160579308398418,0,0,-0.0179172702002446,0.00728522967575982
"773","772,Then Bob proposed:",0,0,0,0,0,-0.369504172281361,0
"774","773,""""""A Merry Christmas to us all, my dears. God bless us!""""""",0.603022689155527,0.603022689155527,0.603022689155527,0,0.904534033733291,1.11800406569435,0.150755672288882
"775","774,Which all the family re-echoed.",0,0,0,0,0,0.282099568710529,0.204124145231932
"776","775,""""""God bless us every one!"""" said Tiny Tim, the last of all.""",0.288675134594813,0.288675134594813,0.288675134594813,0,0.577350269189626,-0.047920072342739,0.0841969142568204
"777","776,He sat very close to his father's side upon his little stool.",0,0,0,0,0,0.28884833967557,0.0577350269189626
"778","777,""Bob held his withered little hand in his, as if he loved the child, and wished to keep him by his side, and dreaded that he might be taken from him.""",0.07184212081071,0.07184212081071,0.179605302026775,0,0.14368424162142,0.043105272486426,-0.42656259231359
"779","778,""""""Spirit,"""" said Scrooge, with an interest he had never felt before, """"tell me if Tiny Tim will live.""""""",0,0,0,0,0,0.0883883476483184,0.0883883476483184
"780","779,""""""I see a vacant seat,"""" replied the Ghost, """"in the poor chimney-corner, and a crutch without an owner, carefully preserved. If these shadows remain unaltered by the Future, the child will die.""""""",-0.174077655955698,-0.174077655955698,-0.348155311911396,-0.174077655955698,0.174077655955698,-0.519273647715847,-0.240807424072049
"781","780,""""""No, no,"""" said Scrooge.""",0,0,0,0,0,0,0
"782","781,""""""Oh, no, kind Spirit! say he will be spared.""""""",0.333333333333333,0.333333333333333,0,0,0.666666666666667,0.596333333333333,0.291666666666667
"783","782,""""""If these shadows remain unaltered by the Future, none other of my race,"""" returned the Ghost, """"will find him here. What then? If he be like to die, he had better do it, and decrease the surplus population.""""""",-0.0486664263392288,-0.0486664263392288,0.162221421130763,0.162221421130763,-0.162221421130763,-0.272531987499681,0.138564130549193
"784","783,""Scrooge hung his head to hear his own words quoted by the Spirit, and was overcome with penitence and grief.""",-0.257147817412476,-0.0335410196624968,-0.447213595499958,-0.223606797749979,-0.223606797749979,-0.0429325051679959,-0.447213595499958
"785","784,""""""Man,"""" said the Ghost, """"if man you be in heart, not adamant, forbear that wicked cant until you have discovered What the surplus is, and Where it is. Will you decide what men shall live, what men shall die? It may be, that in the sight of Heaven, you are more worthless and less fit to live than millions like this poor man's child. Oh God! to hear the Insect on the leaf pronouncing on the too much life among his hungry brothers in the dust!""""""",-0.404372899512894,-0.188707353106017,-0.56073042065788,-0.388197983532378,-0.366631428891691,-0.202057050428603,-0.0649243155329036
"786","785,""Scrooge bent before the Ghost's rebuke, and trembling cast his eyes upon the ground.""",-0.374165738677394,-0.374165738677394,-0.534522483824849,0,-0.534522483824849,-0.0873944261053628,-0.217149759053845
"787","786,""But he raised them speedily, on hearing his own name.""",0.284604989415154,0.284604989415154,0.711512473537885,0,-0.316227766016838,0.177166605910933,0.0922330984215777
"788","787,""""""Mr. Scrooge!"""" said Bob; """"I' give you Mr. Scrooge, the Founder of the Feast!""""""",0.10690449676497,0.10690449676497,0,0,0,-0.178263248355587,0.0222717701593687
"789","788,""""""The Founder of the Feast indeed!"""" cried Mrs. Cratchit, reddening.""",-0.268793601114312,-0.268793601114312,0,0,0,-0.179933598863581,-0.0197642353760524
"790","789,""""""I wish I had him here. I'd give him a piece of my mind to feast upon, and I hope he'd have a good appetite for it.""""""",-0.144337567297406,0.394522683946244,-0.192450089729875,0.192450089729875,0.384900179459751,0.836003189786578,0.178417270687072
"791","790,""""""My dear,"""" said Bob, """"the children! Christmas Day.""""""",0.176776695296637,0.176776695296637,0,0,0.353553390593274,0.352139177030901,0.191508086571357
"792","791,""""""It should be Christmas Day, I am sure,"""" said she, """"on which one drinks the health of such an odious, stingy, hard, unfeeling man as Mr. Scrooge. You know he is, Robert! Nobody knows it better than you do, poor fellow!""""""",-0.577842918987842,-0.577842918987842,-0.78086880944303,-0.312347523777212,-0.156173761888606,-0.204587628074074,-0.288270735486052
"793","792,""""""My dear,"""" was Bob's mild answer, """"Christmas Day.""""""",0.176776695296637,0.176776695296637,0,0,0.353553390593274,0.780645886429948,0.213605173483436
"794","793,""""""I' drink his health for your sake and the Day's,"""" said Mrs. Cratchit, """"not for his. Long life to him! A merry Christmas and a happy new year! He' be very merry and very happy, I have no doubt!""""""",0.119407564292453,0.119407564292453,0.159487641189867,0.159807897497477,0.159487641189867,0.0900150808926069,0.139918646393603
"795","794,The children drank the toast after her.",0,0,0,0,0.377964473009227,0.0226778683805536,0.0472455591261534
"796","795,It was the first of their proceedings which had no heartiness.",0,0,0,0,0,-0.126634764722661,0.113066754216661
"797","796,""Tiny Tim drank it last of all, but he didn't care twopence for it.""",-0.601337794302955,-0.601337794302955,0,0,0,-0.927530140057069,0.15311841984566
"798","797,Scrooge was the Ogre of the family.",-0.302371578407382,-0.302371578407382,0,0,-0.377964473009227,-0.217707536453315,0
"799","798,""The mention of his name cast a dark shadow on the party, which was not dispelled for full five minutes.""",-0.134164078649987,-0.134164078649987,-0.223606797749979,0,-0.223606797749979,-0.495289057016203,-0.21428984784373
"800","799,""After it had passed away, they were ten times merrier than before, from the mere relief of Scrooge the Baleful being done with.""",0.104257207028537,0.104257207028537,0.208514414057075,0,0.208514414057075,-0.103214634958252,-0.0707459619122218
"801","800,""Bob Cratchit told them how he had a situation in his eye for Master Peter, which would bring in, if obtained, full five-and-sixpence weekly.""",0.353009043248731,0.156892908110547,0.196116135138184,0,0.392232270276368,0.398704102735928,-0.049029033784546
"802","801,""The two young Cratchits laughed tremendously at the idea of Peter's being a man of business; and Peter himself looked thoughtfully at the fire from between his collars, as if he were deliberating what particular investments he should favour when he came into the receipt of that bewildering income.""",0.452857142857143,0.195714285714286,0.285714285714286,0.142857142857143,0.285714285714286,0.509285714285714,0.0589285714285714
