"","sent_raw","jockers_rinker","jockers","huliu","lmcd","nrc","senticnet","sentiword"
"366","365,""""""The hour itself,"""" said Scrooge, triumphantly, """"and nothing else!""""""",0.333333333333333,0.333333333333333,0.333333333333333,0,0,-0.302,0.0833333333333333
"367","366,""He spoke before the hour bell sounded, which it now did with a deep, dull, hollow, melancholy ONE.""",-0.471404520791032,-0.471404520791032,-0.707106781186548,0,-0.942809041582063,-0.436049181731704,-0.158397530944367
"368","367,""Light flashed up in the room upon the instant, and the curtains of his bed were drawn.""",0,0,0,0,0,0.205427674405774,0.106109335953396
"369","368,""The curtains of his bed were drawn aside, I tell you, by a hand.""",0,0,0,0,0,0.224766704448349,-0.400891862868637
"370","369,""Not the curtains at his feet, nor the curtains at his back, but those to which his face was addressed.""",0,0,0,0,0,0.157586890714298,-0.244569935039039
"371","370,""The curtains of his bed were drawn aside; and Scrooge, starting up into a half-recumbent attitude, found himself face to face with the unearthly visitor who drew them: as close to it as I am now to you, and I am standing in the spirit at your elbow.""",0.192857142857143,0.192857142857143,0,0,0.571428571428571,0.544285714285714,0.025297619047619
"372","371,""It was a strange figure--like a child: yet not so like a child as like an old man, viewed through some supernatural medium, which gave him the appearance of having receded from the view, and being diminished to a child's proportions.""",-0.308606699924184,-0.308606699924184,-0.308606699924184,-0.154303349962092,-0.154303349962092,0.0754543381314629,0.147874043713671
"373","372,""Its hair, which hung about its neck and down its back, was white as if with age; and yet the face had not a wrinkle in it, and the tenderest bloom was on the skin.""",0.109870053114707,0.109870053114707,0.169030850945703,0,0.338061701891407,0.127618292464006,0.332779487799353
"374","373,""The arms were very long and muscular; the hands the same, as if its hold were of uncommon strength.""",0.362476859515488,0.362476859515488,0,0.229415733870562,0.642364054837573,0.415334244599265,0.0888985968748427
"375","374,""Its legs and feet, most delicately formed, were, like those upper members, bare.""",0.138675049056307,0.138675049056307,0.277350098112615,0,0,0.0560801898383707,0.320108238238309
"376","375,""It wore a tunic of the purest white; and round its waist was bound a lustrous belt, the sheen of which was beautiful.""",0.291920179679905,0.291920179679905,0.41702882811415,0.208514414057075,0.208514414057075,0.215603904135015,0.304083520499901
"377","376,""It held a branch of fresh green holly in its hand; and, in singular contradiction of that wintry emblem, had its dress trimmed with summer flowers.""",0.0784464540552736,0.0784464540552736,0,-0.196116135138184,0,-0.222003464976424,-0.0612862922306825
"378","377,""But the strangest thing about it was, that from the crown of its head there sprung a bright clear jet of light, by which all this was visible; and which was doubtless the occasion of its using, in its duller moments, a great extinguisher for a cap, which it now held under its arm.""",0.195618972513934,0.195618972513934,0.23814483610392,0.136082763487954,0.136082763487954,0.307002714428825,-0.0675553718743773
"379","378,""Even this, though, when Scrooge looked at it with increasing steadiness, was not its strangest quality.""",-0.0375,0.2125,0.25,0,0,-0.20475,-0.130208333333333
"380","379,""For as its belt sparkled and glittered now in one part and now in another, and what was light one instant, at another time was dark, so the figure itself fluctuated in its distinctness: being now a thing with one arm, now with one leg, now with twenty legs, now a pair of legs without a head, now a head without a body: of which dissolving parts, no outline would be visible in the dense gloom wherein they melted away.""",0.245967477524977,0.0167705098312484,0.229196967693728,0,0,0.0125219806739988,-0.108309542660146
"381","380,""And in the very wonder of this, it would be itself again; distinct and clear as ever.""",0.303169531295416,0.121267812518166,0.424437343813583,0,0,0.410903855936555,0.187315460407525
"382","381,""""""Are you the Spirit, sir, whose coming was foretold to me?"""" asked Scrooge.""",0.208012573584461,0.208012573584461,0,0,0.554700196225229,0.402712342459516,0.208012573584461
"383","382,""""""I am!""""""",0,0,0,0,0,0,0
"384","383,The voice was soft and gentle.",0.653197264742181,0.653197264742181,0.816496580927726,0,0,0.189835455065696,0.114819831692961
"385","384,""Singularly low, as if instead of being so close beside him, it were at a distance.""",0,0,0,0,0,-0.0325,-0.190625
"386","385,""""""Who, and what are you?""""""",0,0,0,0,0,0,0
"387","386,Scrooge demanded.",-0.282842712474619,-0.282842712474619,0,0,0,0,0
"388","387,""""""I am the Ghost of Christmas Past.""""""",-0.226778683805536,-0.226778683805536,0,0,0,-0.0971368695633714,-0.0472455591261534
"389","388,""""""Long Past?"""" inquired Scrooge: observant of its dwarfish stature.""",0.2,0.2,0,0,0.333333333333333,0.0113333333333333,0.375
"390","389,""""""No. Your past.""""""",0,0,0,0,0,-0.0334863156129983,0
"391","390,""Perhaps, Scrooge could not have told anybody why, if anybody could have asked him; but he had a special desire to see the Spirit in his cap; and begged him to be covered.""",0.561400440457125,0.744181979210608,-0.182781538753483,0,0.78334945180064,0.0668893393009769,0.200733297023914
"392","391,""""""What!"""" exclaimed the Ghost, """"would you so soon put out, with worldly hands, the light I give? Is it not enough that you are one of those whose passions made this cap, and force me through whole trains of years to wear it low upon my brow!""""""",-0.284436733420894,-0.284436733420894,-0.145864991497895,-0.145864991497895,-0.291729982995789,-0.0668061661060357,-0.0106359889633881
"393","392,""Scrooge reverently disclaimed all intention to offend or any knowledge of having wilfully """"bonneted"""" the Spirit at any period of his life.""",0.287820967080074,0.287820967080074,0,-0.426401432711221,0.21320071635561,0.412330185431751,0.373101253622318
"394","393,He then made bold to inquire what business brought him there.",0.0753778361444409,0.0753778361444409,0,0,0.301511344577764,0.212565497927323,0.414578098794425
"395","394,""""""Your welfare!"""" said the Ghost.""",-0.268328157299975,-0.268328157299975,0,0,0,-0.10107027258299,0.139754248593737
"396","395,""Scrooge expressed himself much obliged, but could not help thinking that a night of unbroken rest would have been more conducive to that end.""",-0.109716728062163,-0.420495739177779,0.310779011115616,-0.295980010586301,-1.21453866412999,-0.514995012212902,0.310651433524846
"397","396,""The Spirit must have heard him thinking, for it said immediately:""",0.150755672288882,0.150755672288882,0,0,0.301511344577764,0.953378871554889,-0.0753778361444409
"398","397,""""""Your reclamation, then. Take heed!""""""",0.357770876399966,0.357770876399966,0,0,0.447213595499958,0.293819332243472,0.0978279740156158
"399","398,""It put out its strong hand as it spoke, and clasped him gently by the arm.""",0.125,0.125,0.25,0.25,-0.25,0.171,0.0625
"400","399,""""""Rise! and walk with me!""""""",0,0,0,0,0,-0.00223606797749979,0.111803398874989
"401","400,""It would have been in vain for Scrooge to plead that the weather and the hour were not adapted to pedestrian purposes; that bed was warm, and the thermometer a long way below freezing; that he was clad but lightly in his slippers, dressing-gown, and nightcap; and that he had a cold upon him at that time.""",0.223220935861528,0.0853491813588197,0.137871754502709,0.131306432859723,-0.131306432859723,0.37149872516837,0.121048117792557
"402","401,""The grasp, though gentle as a woman's hand, was not to be resisted.""",0.277350098112615,0.277350098112615,0.277350098112615,0,0,0.298983405765399,0.138675049056307
"403","402,""He rose: but finding that the Spirit made towards the window, clasped his robe in supplication.""",0.18125,0.18125,0,0,0.8125,0.5604375,0.2578125
"404","403,""""""I am a mortal,"""" Scrooge remonstrated, """"and liable to fall.""""""",-0.237170824512628,-0.237170824512628,-0.632455532033676,0,-0.632455532033676,-0.117636728958264,-0.103213229186051
"405","404,""""""Bear but a touch of my hand there,"""" said the Spirit, laying it upon his heart, """"and you shall be upheld in more than this!""""""",0.316,0.316,0.36,0,0.2,0.3590046,0.1030875
"406","405,""As the words were spoken, they passed through the wall, and stood upon an open country road, with fields on either hand.""",0,0,0,0,-0.21320071635561,0.33365912109653,-0.195433989992643
"407","406,The city had entirely vanished.",-0.268328157299975,-0.268328157299975,0,0,-0.447213595499958,-0.368951216287465,0.223606797749979
"408","407,Not a vestige of it was to be seen.",0,0,0,0,0,-0.206666666666667,0
"409","408,""The darkness and the mist had vanished with it, for it was a clear, cold, winter day, with snow upon the ground.""",-0.341121146168977,-0.341121146168977,-0.426401432711221,0,-0.639602149066831,0.542382622408673,-0.0929580504348123
"410","409,""""""Good Heaven!"""" said Scrooge, clasping his hands together, as he looked about him.""",0.429892652074553,0.429892652074553,0.554700196225229,0.277350098112615,0.277350098112615,0.260709092225858,0.164676620754365
"411","410,""""""I was bred in this place. I was a boy here!""""""",0.0753778361444409,0.0753778361444409,0,0,-0.301511344577764,-0.0361813613493316,-0.0376889180722205
"412","411,The Spirit gazed upon him mildly.",0.204124145231932,0.204124145231932,0,0,0.408248290463863,0.280874823839138,0.127577590769957
"413","412,""Its gentle touch, though it had been light and instantaneous, appeared still present to the old man's sense of feeling.""",0.335410196624968,0.335410196624968,0.223606797749979,0,0.447213595499958,0.0234787137637478,0.0715408653515558
"414","413,""He was conscious of a thousand odours floating in the air, each one connected with a thousand thoughts, and hopes, and joys, and cares long, long, forgotten!""",0.211695098702863,0.211695098702863,0.192450089729875,0,-0.192450089729875,-0.489977928452262,0.120281306081172
"415","414,""""""Your lip is trembling,"""" said the Ghost.""",-0.41576092031015,-0.41576092031015,0,0,-0.377964473009227,-0.257015841646275,-0.0708683386892301
"416","415,""""""And what is that upon your cheek?""""""",0,0,0,0,0,0.0419540565040242,0
"417","416,""Scrooge muttered, with an unusual catching in his voice, that it was a pimple; and begged the Ghost to lead him where he would.""",-0.244948974278318,-0.244948974278318,-0.204124145231932,0,0,0.117371383508361,-0.102062072615966
"418","417,""""""You recollect the way?"""" inquired the Spirit.""",0.188982236504614,0.188982236504614,0,0,0.377964473009227,0.232070186427666,0.14173667737846
"419","418,""""""Remember it!"""" cried Scrooge with fervour; """"I could walk it blindfold.""""""",-0.301511344577764,-0.301511344577764,0,0,0,0.412769030726958,0.163318644979622
"420","419,""""""Strange to have forgotten it for so many years!"""" observed the Ghost.""",-0.461880215351701,-0.461880215351701,-0.288675134594813,0,-0.288675134594813,0.125285008414149,-0.180421959121758
"421","420,""""""Let us go on.""""""",0,0,0,0,0,0.068,-0.0625
"422","421,""They walked along the road, Scrooge recognising every gate, and post, and tree; until a little market-town appeared in the distance, with its bridge, its church, and winding river.""",0.0182574185835055,0.0182574185835055,0,-0.182574185835055,0.365148371670111,-0.0989552087226,-0.0273861278752583
"423","422,""Some shaggy ponies now were seen trotting towards them with boys upon their backs, who called to other boys in country gigs and carts, driven by farmers.""",0,0,0,0,0,0.383553028831641,0.132309436689289
"424","423,""All these boys were in great spirits, and shouted to each other, until the broad fields were so full of merry music, that the crisp air laughed to hear it!""",0.59336610396393,0.59336610396393,0.547722557505166,0.182574185835055,0.547722557505166,0.698528835004922,0.273861278752583
"425","424,""""""These are but shadows of the things that have been,"""" said the Ghost.""",-0.166410058867569,-0.166410058867569,0,0,0,0.278544644985186,-0.346687622640768
"426","425,""""""They have no consciousness of us.""""""",-0.163299316185545,-0.163299316185545,0,0,-0.408248290463863,-0.820170815541901,0.204124145231932
"427","426,""The jocund travellers came on; and as they came, Scrooge knew and named them every one.""",0,0,0,0,0,-0.26075,0
"428","427,Why was he rejoiced beyond all bounds to see them!",0.316227766016838,0.316227766016838,0,0,0,0.372832536133852,0.221359436211787
"429","428,""Why did his cold eye glisten, and his heart leap up as they went past!""",0.0258198889747161,0.0258198889747161,0,0,-0.258198889747161,0.437388919231691,0.0806871530459878
"430","429,""Why was he filled with gladness when he heard them give each other Merry Christmas, as they parted at cross-roads and bye-ways, for their several homes!""",0.330718913883074,0.330718913883074,0.377964473009227,0,0.188982236504614,0.483605543215306,-0.185045106577434
"431","430,What was merry Christmas to Scrooge?",0.408248290463863,0.408248290463863,0.408248290463863,0,0.408248290463863,0.47030203061437,0
"432","431,Out upon merry Christmas!",0.5,0.5,0.5,0,0.5,0.6465,0
"433","432,What good had it ever done to him?",0.265165042944955,0.265165042944955,0.353553390593274,0.353553390593274,0.353553390593274,0.234759451353934,0.165728151840597
"434","433,""""""The school is not quite deserted,"""" said the Ghost.""",-0.16,-0.16,0,0,0.0666666666666667,-0.232733333333333,-0.0416666666666667
"435","434,""""""A solitary child, neglected by his friends, is left there still.""""""",-0.0452267016866646,-0.0452267016866646,-0.301511344577764,-0.301511344577764,0,-0.141107309262393,-0.220749377280148
"436","435,Scrooge said he knew it.",0,0,0,0,0,0,0
"437","436,And he sobbed.",-0.577350269189626,-0.577350269189626,0,0,0,0,0
"438","437,""They left the high-road, by a well-remembered lane, and soon approached a mansion of dull red brick, with a little weathercock-surmounted cupola, on the roof, and a bell hanging in it.""",-0.0342997170285018,-0.0342997170285018,0,0,-0.342997170285018,0.411047808869565,-0.0599828551434863
"439","438,""It was a large house, but one of broken fortunes; for the spacious offices were little used, their walls were damp and mossy, their windows broken, and their gates decayed.""",-0.51805425230697,-0.51805425230697,-0.739425452631974,-0.59336610396393,-0.739425452631974,-0.561926829163133,-0.0918576372482622
"440","439,Fowls clucked and strutted in the stables; and the coach-houses and sheds were over-run with grass.",0,0,0,0,0,0.0605754809216476,-0.0883883476483184
"441","440,""Nor was it more retentive of its ancient state, within; for entering the dreary hall, and glancing through the open doors of many rooms, they found them poorly furnished, cold, and vast.""",-0.256326208180123,-0.256326208180123,-0.530330085889911,-0.176776695296637,-0.318198051533946,-0.0531744299452284,-0.308990931987247
"442","441,""There was an earthy savour in the air, a chilly bareness in the place, which associated itself somehow with too much getting up by candle-light, and not too much to eat.""",-0.194454364826301,-0.109601551083915,-0.176776695296637,0,-0.212132034355964,0.0282842712474619,-0.223180577812004
"443","442,""They went, the Ghost and Scrooge, across the hall, to a door at the back of the house.""",-0.14142135623731,-0.14142135623731,0,0,0,0.183612060848107,0.0294627825494395
"444","443,""It opened before them, and disclosed a long, bare, melancholy room, made barer still by lines of plain deal forms and desks.""",-0.106600358177805,-0.106600358177805,-0.21320071635561,-0.21320071635561,0,-0.579692747770905,-0.116118247300824
"445","444,""At one of these a lonely boy was reading near a feeble fire; and Scrooge sat down upon a form, and wept to see his poor forgotten self as he used to be.""",-0.417786374293675,-0.417786374293675,-0.522232967867094,-0.174077655955698,-0.522232967867094,-0.149532706465944,-0.264380439982716
"446","445,""Not a latent echo in the house, not a squeak and scuffle from the mice behind the panelling, not a drip from the half-thawed water-spout in the dull yard behind, not a sigh among the leafless boughs of one despondent poplar, not the idle swinging of an empty store-house door, no, not a clicking in the fire, but fell upon the heart of Scrooge with a softening influence, and gave a freer passage to his tears.""",0.194077662909739,0.0815688728171367,0.196890382662054,0.112508790092602,-0.140635987615753,0.1026642709595,0.242262231047613
"447","446,""The Spirit touched him on the arm, and pointed to his younger self, intent upon his reading.""",0.266789187539966,0.266789187539966,0,0,0.485071250072666,0.381508538182152,0.18190171877725
"448","447,""Suddenly a man, in foreign garments: wonderfully real and distinct to look at: stood outside the window, with an axe stuck in his belt, and leading by the bridle an ass laden with wood.""",-0.00857492925712543,-0.00857492925712543,0.308697453256516,0.171498585142509,-0.377296887313519,-0.103036349953619,0.160779923571102
"449","448,""""""Why, it's Ali Baba!""""""",0,0,0,0,0,0,0
"450","449,Scrooge exclaimed in ecstasy.",0.375,0.375,0.5,0,0.5,0.1665,0
"451","450,""""""It's dear old honest Ali Baba! Yes, yes, I know! One Christmas time, when yonder solitary child was left here all alone, he did come, for the first time, just like that. Poor boy! And Valentine,"""" said Scrooge, """"and his wild brother, Orson; there they go! And what's his name, who was put down in his drawers, asleep, at the Gate of Damascus; don't you see him! And the Sultan's Groom turned upside down by the Genii; there he is upon his head! Serve him right. I' glad of it. What business had he to be married to the Princess!""""""",0.54,0.54,0.2,-0.1,0.3,0.3724,0.331041666666667
"452","451,""To hear Scrooge expending all the earnestness of his nature on such subjects, in a most extraordinary voice between laughing and crying; and to see his heightened and excited face; would have been a surprise to his business friends in the city, indeed.""",0.39344631145812,0.553569810307355,0.419371068414663,0.152498570332605,0.731993137596502,0.754349428007262,0.0638587763267782
"453","452,""""""There's the Parrot!"""" cried Scrooge.""",-0.447213595499958,-0.447213595499958,0,0,-0.447213595499958,-0.366715148309965,0
"454","453,""""""Green body and yellow tail, with a thing like a lettuce growing out of the top of his head; there he is! Poor Robin Crusoe, he called him, when he came home again after sailing round the island. 'Poor Robin Crusoe, where have you been, Robin Crusoe?' The man thought he was dreaming, but he wasn't. It was the Parrot, you know. There goes Friday, running for his life to the little creek! Halloa! Hoop! Halloo!""""""",0.206474160483506,0.0917662935482247,0.114707866935281,-0.114707866935281,0.487508434474944,0.557227875998207,-0.252357307257618
"455","454,""Then, with a rapidity of transition very foreign to his usual character, he said, in pity for his former self, """"Poor boy!"""" and cried again.""",-0.296,-0.296,-0.4,-0.2,-0.2,-0.6142,0.0575
"456","455,""""""I wish,"""" Scrooge muttered, putting his hand in his pocket, and looking about him, after drying his eyes with his cuff: """"but it's too late now.""""""",-0.502547596291597,0.0465775820953187,-0.392232270276368,-0.441261304060914,-0.441261304060914,0.332514907126791,0.113379640626763
"457","456,""""""What is the matter?"""" asked the Spirit.""",0.188982236504614,0.188982236504614,0,0,0.377964473009227,0.398752519024735,0.14173667737846
"458","457,""""""Nothing,"""" said Scrooge.""",0,0,0,0,0,-0.415692193816531,0
"459","458,""""""Nothing. There was a boy singing a Christmas Carol at my door last night. I should like to have given him something: that's all.""""""",0.153093108923949,0.153093108923949,0.204124145231932,0,0,0.219025207833863,0.0340206908719886
"460","459,""The Ghost smiled thoughtfully, and waved its hand: saying as it did so, """"Let us see another Christmas!""""""",0.282842712474619,0.282842712474619,0.235702260395516,0,0,0.375473700810057,0.0324090608043834
"461","460,""Scrooge's former self grew larger at the words, and the room became a little darker and more dirty.""",-0.318198051533946,-0.318198051533946,-0.471404520791032,0,-0.471404520791032,0.0318198051533946,-0.147313912747197
"462","461,""The panels shrunk, the windows cracked; fragments of plaster fell out of the ceiling, and the naked laths were shown instead; but how all this was brought about, Scrooge knew no more than you do.""",-0.253546276418555,-0.253546276418555,-0.338061701891407,0,-0.50709255283711,-0.19052312364345,0.232417420050342
"463","462,""He only knew that it was quite correct; that everything had happened so; that there he was, alone again, when all the other boys had gone home for the jolly holidays.""",0.134703976520081,0.134703976520081,0.35921060405355,0,0,0.377171134256227,0.0149671085022312
"464","463,""He was not reading now, but walking up and down despairingly.""",-0.708551659757745,-0.0301511344577764,-0.678400525299968,0,-0.301511344577764,-0.589756189994106,0.150755672288882
"465","464,""Scrooge looked at the Ghost, and with a mournful shaking of his head, glanced anxiously towards the door.""",-0.612825877028341,-0.612825877028341,-0.471404520791032,0,-0.471404520791032,-0.326683332908185,-0.206239477846076
"466","465,""It opened; and a little girl, much younger than the boy, came darting in, and putting her arms about his neck, and often kissing him, addressed him as her """"Dear, dear brother.""""""",0.406586399182265,0.406586399182265,0,0,0.530330085889911,0.501515484556559,0.276213586400995
"467","466,""""""I have come to bring you home, dear brother!"""" said the child, clapping her tiny hands, and bending down to laugh.""",0.436435780471985,0.436435780471985,0,0,0.87287156094397,0.723610524022551,-0.0340965453493738
"468","467,""""""To bring you home, home, home!""""""",0,0,0,0,0,0.077567175188134,0.102062072615966
"469","468,""""""Home, little Fan?"""" returned the boy.""",0.0204124145231931,0.0204124145231931,0,0,-0.0816496580927726,0.120188296712561,0.112268279877562
"470","469,""""""Yes!"""" said the child, brimful of glee.""",0.812623616969838,0.812623616969838,0.377964473009227,0,0.755928946018454,-0.0978927985093899,-0.118113897815384
"471","470,""""""Home, for good and all. Home, for ever and ever. Father is so much kinder than he used to be, that home's like Heaven! He spoke so gently to me one dear night when I was going to bed, that I was not afraid to ask him once more if you might come home; and he said Yes, you should; and sent me in a coach to bring you. And you're to be a man!"""" said the child, opening her eyes, """"and are never to come back here; but first, we're to be together all the Christmas long, and have the merriest time in all the world.""""""",0.452432676873371,0.452432676873371,0.212682027590046,0.0966736489045664,0.212682027590046,0.229106880538932,0.244705173789684
"472","471,""""""You are quite a woman, little Fan!"""" exclaimed the boy.""",0.0158113883008419,0.0158113883008419,0,0,-0.0632455532033676,0.338553446297627,0.0474341649025257
"473","472,""She clapped her hands and laughed, and tried to touch his head; but being too little, laughed again, and stood on tiptoe to embrace him.""",0.47,0.47,0,0,0.2,0.34467,-0.14875
"474","473,""Then she began to drag him, in her childish eagerness, towards the door; and he, nothing loth to go, accompanied her.""",-0.109108945117996,-0.109108945117996,-0.218217890235992,-0.218217890235992,0,-0.028586543620915,-0.0181848241863327
"475","474,""A terrible voice in the hall cried, """"Bring down Master Scrooge's box, there!"""" and in the hall appeared the schoolmaster himself, who glared on Master Scrooge with a ferocious condescension, and threw him into a dreadful state of mind by shaking hands with him.""",-0.429653666023313,-0.731165010601077,-0.150755672288882,0,-0.452267016866645,0.0578901781589306,0
"476","475,""He then conveyed him and his sister into the veriest old well of a shivering best-parlour that ever was seen, where the maps upon the wall, and the celestial and terrestrial globes in the windows, were waxy with cold.""",0.189736659610103,0.189736659610103,0.158113883008419,0.158113883008419,0,0.314488513303745,0.140223297146016
"477","476,""Here he produced a decanter of curiously light wine, and a block of curiously heavy cake, and administered instalments of those dainties to the young people: at the same time, sending out a meagre servant to offer a glass of """"something"""" to the postboy, who answered that he thanked the gentleman, but if it was the same tap as he had tasted before, he had rather not.""",0.23212194427698,0.23212194427698,0,0,0.24433888871261,-0.0679567534231948,-0.138585963441684
"478","477,""Master Scrooge's trunk being by this time tied on to the top of the chaise, the children bade the schoolmaster good-bye right willingly; and getting into it, drove gaily down the garden-sweep: the quick wheels dashing the hoar-frost and snow from off the dark leaves of the evergreens like spray.""",0.968391975838258,0.556310283992191,0.961523947640823,0.137360563948689,0.824163383692134,0.532546906429067,0.18600909701385
"479","478,""""""Always a delicate creature, whom a breath might have withered,"""" said the Ghost.""",-0.346687622640768,-0.346687622640768,0.277350098112615,0,-0.554700196225229,-0.137842998761969,-0.346687622640768
"480","479,""""""But she had a large heart!""""""",0,0,0,0,0,0.249847953763884,0.114819831692961
